id,eng,sot,nso,ssw,ven,nbl,xho,zul,tsn,tso,eng_pos_or_descriptor,eng_pos_or_descriptor_info,sot_pos_or_descriptor,sot_pos_or_descriptor_info,nso_pos_or_descriptor,nso_pos_or_descriptor_info,ssw_pos_or_descriptor,ssw_pos_or_descriptor_info,ven_pos_or_descriptor,ven_pos_or_descriptor_info,nbl_pos_or_descriptor,nbl_pos_or_descriptor_info,xho_pos_or_descriptor,xho_pos_or_descriptor_info,zul_pos_or_descriptor,zul_pos_or_descriptor_info,tsn_pos_or_descriptor,tsn_pos_or_descriptor_info,tso_pos_or_descriptor,tso_pos_or_descriptor_info
unisa_multilingual_linguistic_terminology_443,discourse analysis,,phetlekopoledišano,Luhlatiyo lwenkhulumo,,ukuhlungwa kwekulumo,isibanjalo esiguqu-guqukayo,ukuhlaziywa kwenkulumo,,,,,,,phetleko ya kgokagano ya go ngwalwa goba ya molomo,Phetlekopoledišano ke lekala la thutapolelo le le re thušago go kwešiša botšo bja mmoledi le bja mmoledišwa mabapi le se ba bolelago ka sona,Sifundvo lesihlola ngeliso lelibanti  inshokutsi yenkhulumo lebhaliwe nalekhulunywako,Masesi uchuba sifundvo sakhe sekuhlatiya inkhulumo,,,"isifundo esihlunga besihlathulule bonyana imitjho ethulwa ekulumeni ngomlomo netloliweko izakha bunjani iindima, imikhulumiswano, njll. ezwakalako.",Yikulumo eyenziwa ngomlomo nofana ngokutlolwa ngendlela abantu abathula ngayo lokho abakucabangako.,"sichaza ubudlelwane obubandakanya inguquko ethile kwaye siguqulelwa njengo 'ba'. (Louwrens, 1994: 41)",u- 'ba' sisibanjalo esiguqu-guquka njengesenzi,isifundo esihlaziya futhi sichaze ukuthi imisho enkulumeni eyethulwa ngomlomo nebhaliwe izakha kanjani izingxenye ezinkulu ezinomqondo,abacwaningi bahlaziya inkulumo ukuhlola izimpawu zayo,,,,
unisa_multilingual_linguistic_terminology_444,disyllabic word,,lentšunokopedi,,,igama elimalungamabili,ixabiso lovakalelo,igama elimalungamabili,,,,,,,lentšu le le nago le dinoko tše pedi,"Motho' ke leinantšu la nokopedi, dinoko tša lona ke mo le tho",,,,,igama elakhiwe ngamalunga amabili,Itjhada elinjengo-v liphinyiswa ngokungakanqophi.,"Intsingiselo yentetho enovakalelo ebhekiselela kwisiphumo sovakalelo komameleyo, njengakwi ‘siqulatho sovakalelo’ seentetho ezisasazwayo, ulwimi losasazo (Crystal, 2008: 167); linxulumene neemvakalelo ezingaphakathi zomsebenzisi wolwimi (Louwrens, 1994: 61)",ixabiso lovakalelo libaluleke kwisithethi nakomameleyo xa bebambe incoko,isakhiwo segama elinamalunga amabili,maningi amagama anhlamvumbili olimini,,,,
unisa_multilingual_linguistic_terminology_445,ditransitive/ double transive,,lefetedipedi,,,,,,,,,,,,lediri leo ka tlhago le bago le didirwa tše pedi,Kutudiri ya -fa ke mohlala wa lefetedipedi ka ge le nyaka didirwa tše pedi gore le hlame lefoko le le phethegilego,,,,,,,,,,,,,,
unisa_multilingual_linguistic_terminology_446,dynamic copulative relationship,,tswalanolebatšweledi,,,,,,,,,,,,tlhalošo ya leba ye e laetšago gore tswalano e a fetoga,'Monna e ba mohumi' ke tswalano ya lebatšweledi ka gore tiragalo ya go ba mohumi e gare e tšwela pele go direga,,,,,,,,,,,,,,
unisa_multilingual_linguistic_terminology_447,emphatic pronoun,,lešalakgatelelo,Sabito lesigcizelelo,,isabizwana esigandelelako,intetho echazayo,isabizwana esigcizelelayo,,,,,,,lešala leo le šomišwago go laetša kgatelelo,Lešalašala ge le bapetše le leina le šoma bjalo ka lešalakgatelelo; ka nako ye nngwe e ba mašala a mabedi bjalo ka mo lefokong le: Nna yena ga ke begelwe selo,Sabito lesisetjentiselwa kugcizelela libito lesililandzelako,Tonkhe tabito letilandzela libito tisebenta umsebenti wekugcizelela .,,,isabizwana esigandelelako ibizo nofana sibeka ibizo ebaleni,Abafundi bakhe bona bayawenza umsebenzi nofana yena avilapha nje. Kilomutjho ukusetjenziswe kwesabizwana nebizo kunokugandelela.,"uhlobo lwentetho apho isithethi sichaza khona iimvakalelo zaso (Crystal, 2008: 180)",intetho echazayo iqulatha intsingiselo ebandakanya ukuchukumiseka kovakalelo,isabizwana esigcizelela ibizo noma esigqamisa ibizo,isabizwana esigcizelelayo sisebenza kancane kunesabizwana soqobo,,,,
unisa_multilingual_linguistic_terminology_448,extended root,,modukatološwa,,,,,,,,,,,,modu wo o hlomeseditšwego dikatološo,Ge kutudirikatološwa e amogwa moselana wa phetho go šala modukatološwa,,,,,,,,,,,,,,
unisa_multilingual_linguistic_terminology_449,feminine gender,,bongtshadi,,,,,,,,,,,,pharologantšho ya go laetša botshadi,Mantšu a mangwe a hlomelwa moselana wa -gadi go laetša bongtshadi,,,,,,,,,,,,,,
unisa_multilingual_linguistic_terminology_450,figurative meaning,,tlhalošoseka,,,ukusebenzisa iimfenqo,ulwazi olwaziwayo ngomameleyo,umqondo ocashile,,,,,,,"tlhalošo ya lentšu, sekafoko goba lefoko ye e sego ya mehleng gomme e hlaloša selo ka dika tša se sengwe",Tlhalošo ya mehleng ya lentšu le noga e šupa segagabi mola tlhalošoseka e šupa motho wa go se diregane ka mekgwa,,,,,kusetjenziswa komutjho ngendlela engakanqophi nofana efihlekileko,"Egameni , umfundisikazi, isakhi u-kazi usilungelelo esikhoma ubululi besifazi.","""iinkcukacha ebesezinikwe kwimo yezeelwimi ebekubhekiselelwe kuyo ngaphambili nangona iinkcukacha  'ezintsha', njengoko lisitsho igama, bezingekanikwa
 (Crystal, 2008: 211)""",ulwazi olunikwe sisithethi nolwaziwayo ngomameleyo,umqondo ocashile ohlukile kulowo osobala,izaga zinomqondo ocashile nosobala,,,,
unisa_multilingual_linguistic_terminology_451,forensic phonetics,,thutamedumo ya forensiki,,,,,,,,,,,,lekala la thutamedumo leo le swaraganego le go thuša dinyakišišong tša bosenyi,Boramaleme ba ba ithutilego thutamedumo ya forensiki ba kgona go rarolla melato moo e lego gore mesenyi o ile a bolela se sengwe.,,,,,,,,,,,,,,
unisa_multilingual_linguistic_terminology_452,fricative,,tumammogogwaša,Ngwacamfutfwa,,umavuthelwa,intsebenzo-matshini yomsinga womoya yesangozwi,umfuthwa; umahlikihla,,,,,,,modumopolelo wo o bitšwago ka pitlagano ya moelamoya,"F[f], s[s] ke ye mengwe ya mehlala ya ditumammogogwaša",Umsindvo lophinyiswa ngekutsi umoya uphume ngekufutseka emkhatsini kwetitfo tekukhuluma,Bongwacamfutwa basebentisa umoya lophuma emaphashini / Ticinisamfutfo,,,Litjhada eliphinyiswa ngokobana kunciphe indawo yokuphuma kommoya ugcine sele uphume ngamandla.,Isibabazo sokusilingeka esithi nx! ligama elakhiwe sisakhi esisodwa,"izandi eziphinyiselwa xa kuvaleke isangozwi, ezenzeka ngaphandle kokubandakanyeka komoya ongqalileyo ovela emiphungeni. Kuxinzeleleka umoya emlonyeni okanye emqaleni ngasentla kwesangozwi elivaliweyo, uze uphume usabambekile umphefumlo (Crystal, 2008: 213)",intsebenzo-matshini yomsinga womoya wesangozwi isetyenziselwa ukuphimisela izandi ezitsoliswayo ubukhulu becala,umsindo othi lapho uphinyiswa kube nokumpintsheka okuncane komoya ophuma emaphashini ngenxa yokusondelana kweziphimisi okudala ukuhlihliza,umfuthwa umsindo ophimiseka kalula,,,,
unisa_multilingual_linguistic_terminology_453,future tense,,letlago,Sikhatsi lesitako,,ikathi ezako,,inkathi ezayo,pakatlang,,,,,,lebaka leo tiro e tlogo go direga ka lona,Lebopi la letlago ke tla- goba tlo-,Sikhatsi sesento lesichaza kutsi sento sitawenteka ngesikhatsi lesitako,Yonkhe imisho yakhe isenkhatsini letako.,,,Nangabe isenzo sisetjenziselwe ukuqalisa esenzweni esizokwenzeka esikhathini esizako.,Ukusetjenziswa kwesikhathi esizako               (a) Izakhi u-zoku- no-yoku ziyasetjenziswa ngokurhunyeziweko njengo-zo no-yo-              Isibonelo:                                                 Batjho bazombona kusasa.                              Fika kusasa ngizakukhamba nawe.                 Ugijime uyomthola angakakhambi.,,,isikhathi esizayo okuzokwenzeka ngaso okuthile,inkathi ezayo kulula ukuyibona,e supa ditiro tse di tla diriwang mo isagweng,"fa ke re, 'ke tla simolola go ikatisa mo bekeng yona e', ke bontsha pakatlang.",,
unisa_multilingual_linguistic_terminology_454,ga-locative class,,legorofelo la ga-,,,,,,,,,,,,legoroina la hlogo ya ga- la go šupa lefelo,Gare ke leinatšu la lefelo leo le welago legorongfelo la ga-,,,,,,,,,,,,,,
unisa_multilingual_linguistic_terminology_455,gender,,bong,Bulili,,ubuliliboke,uvumelwano ngokwegrama,ubulili,,,,,,,taetšo ya bongtona goba bongtshadi,Mašala le makgokedi a Sesotho sa Leboa ga a kgetholle bong bjalo ka a dipolelo tša go swana le Seisimane le Seburu,Indlela yelulwimi lesebentisa emagama lahlukanisa bulili lobusikati nalobudvuna.,Kubi kucwasana ngebulili,,,magama atjengisa ubulili bobusikazi nobobuduna.,"Kilomutjho, Umrharibo uyapheka. Isakhi sekathi u-ya sikhombisa ikathi yanje indlela ede. Kunendlela yanje efitjhani engasebenzisi u-ya. Isib. Abantwana bagijimisa ikukhu.","ubudlelwane obucwangciselweyo phakathi kwezakhi zamagama (Crystal, 2008: 18)",uvumelwano ngokwegrama lubandakanya ukusetyenziswa kwezivumelanisi ezibumba intsingiselo yesivakalisi,amagama akhomba ubulili besilisa nobesifazane,ubulili buyinto engabonakali kalula engxoxweni,,,,
unisa_multilingual_linguistic_terminology_456,generic meaning,,tlhalošomohuta,,,,,,,,,,,,"tlhalošo ye e tšweletšwago ke lentšu leo le dirišwago go šupa dilo tša mohlobo o tee ka go di akaretša, le sa šupe selo ka se tee ka se tee",Ka go 'Nku ke seruiwa' leinantšu nku le na le tlhalošomohlobo ka ge le sa šupe nku e tee eupša legoro la 'bonku' ka moka,,,,,,,,,,,,,,
unisa_multilingual_linguistic_terminology_457,geographical dialect,,mmoleloselete,,,ilimi lesigodi,,ulimi lwesigodi,,,,,,,mohuta wa polelo wo o bolelwago seleteng se se itšego sa polelo ye e itšego,"Sesotho sa Leboa se na le mebolelo ye mmalwa ya dilete bjalo ka Sehananwa, Sepedi, Sepulana le ye mengwe.",,,,,ilimi elikhulunywa babantu abahlala endaweni ethileko elihlukileko kilelo elisemthethweni,"ubuliliboke buhlukaniswa kabili, bulili obuveza ubusikazi nobuduna",,,ulimi olukhulunywa ngabantu abahlala endaweni ethile olwelukile olimini oluthathwa njengolusezingeni,ulimi lwesigodi ngiyaluthanda,,,,
unisa_multilingual_linguistic_terminology_458,glottal sound,,tumahee,Bomphinjeni,,,,,,,,,,,modumopolelo wo o kwagatšwago ka kodu le sehebehebe ka nako e tee,Modumopolelo wa mathomo mo go 'hema' ke tumahee,Umsindvo lophimnyiswa emphinjeni ngemuva kwemlomo nelilakanya.,Ungete wabaphimisa bomphinjeni nawuphetfwe ngumphimbo,,,,,,,,,,,,
unisa_multilingual_linguistic_terminology_459,gradability,,tekanyetšo*,Lokuhlelekako,,,,,,,,,,,ka thutatlhalošo yo go ka fapantšhwago malatodi a a ka lekanyetšwago le a a ka se lekanyetšwego,Go hwa le go phela ke malatodi a a se nago tekanyetšo ka ge go se na kgonagalo ya gore go be le maemo a go fapafapana a go hwa goba a go phela,Tintfo letihlelekako ngekwetigaba tato.,Emabito ayahleleka ngekwetigaba tawo.,,,,,,,,,,,,
unisa_multilingual_linguistic_terminology_460,grammar,,thutapolelo,Luhlelo lwelulwimi,,ihlelo lelimi,izifundo ngomba woomabizwafane abahluka ngemvakalozwi nangeentsingiselo ziyinxenye yokufundwa kwegrama,igrama,,,,,,,saense ya phetleko le tlhalošo ya polelo,Segagešo' ke molokoloko wa dipuku tša thutapolelo tša go ngwalwa ke Louwrens le Nokaneng / popopolelo,"Indlela yekuchaza lulwimi, kwakheka nekusetjentisawa kwalo",Luhlelo lwelulwimi  lulukhuni,,,"indlela yokutlolwa, yokupeledwa nokusetjenziswa kwelimi ngendlela efaneleko.",Kunemikhakha ehlukileko yehlelo lelimi efundisa ngokwakheka kwamagama asetjenziswa elimini.,"uhlalutyo lwamagama (aziwa ngumntu) olubonisa oomabizwafane abangagqibelelanga, oko kukuthi, baneentsingiselo ezahlukileyo, kodwa ulwakhiwo lwabo lufana twatse kumgaqo othile kuphela (oko kukuthi kwintetho okanye ekubhaleni). Imizekelo yoomabizwafane ngamagama afana nokuthi ukuthiya okuthetha ukucaphukela, aphinde athethe ukunika umntu okanye umntwana igama kanti futhi ukuthiya kuthetha ukubambisa izinto ezingafunekiyo njengokubambisa iimpuku endlwini. (Crystal, 2008: 227)",ukusetyenziswa koomabizwafane abafana ngolwakhiwo kodwa bahluke ngemvakalozwi nangentsingiselo,indlela nemithetho yokubhalwa nokuhlaziywa kolimi,igrama yinto okungelula ukuyifunda,,,,
unisa_multilingual_linguistic_terminology_461,grammatical meaning,,tlhalošolebopi*,Inshokutsi ngekwelulwimi,,ihlathululo yehlelo lelimi,ukusetyenziswa koomabizwafane,incazelo yohlelo lolimi,,,,,,,tlhalošo ye e tlišwago ke mabopi mo mantšung ka lebaka la mošomo wo a o dirago,Tlhalošolebopi ya -an- ke tirano gomme ge lebopi le le hlomelwa kutudiring le tliša bodirani,Inshokutsi lekhomba budlelwano kumagama noma emshweni.,Ikhona yini inshokutsi ngekweluhelo lwelulwimi kulenkhulumo?,,,ihlathululo elethwa kusetjenziswa kwezakhi egameni.,"Isivumelwano siletha ubudlelwana phakathi kwesenzo nebizo eliyihloko yomutjho, isibonelo, Abantwana bakhambe ngebhesi esikolweni. Isivumelwano sesenzo bakhambe, u-ba- senze ubudlelwana nesithomo sebizo aba-","kubhekiselela kwiziganeko apho amagama amabini anolandelelwano lwezandi olufana twatse kodwa abe neentsingiselo ezahlukileyo (Louwrens, 1994: 75-76); uhlalutyo lweentsingiselo olubhekiselela emagameni aziwa ngumntu nanolwakhiwo olufana twatse kodwa abe neentsingiselo ezahlukileyo (Crystal, 2008: 231)",ukusetyenziswa koomabizwafane abafana ngolwakhiwo kodwa bahluke ngentsingiselo,incazelo elethwa wukusetshenziswa kwezakhi egameni noma emshweni,incazelo yohlelo lolimi iyinto esobala ukuyithola,,,,
unisa_multilingual_linguistic_terminology_462,grammaticality,,nepagalo go ya ka thutapolelo,,,,,,,,,,,,sebopego sa lefoko se se dumelelanago le melao ya thutapolelo lelemeng le le itšego,Ge leina la legoro la 1 le ka kgokagana le lediri ka lekgokasediri la legoro la 5 gona lefoko leo le tlo ba le tshetše melao ya nepagalo go ya ka popolelo,,,,,,,,,,,,,,
unisa_multilingual_linguistic_terminology_463,habitual action,,tirotlwaelo,,,,,,,,,,,,tiro ye e dirwago ka mehla ka setlwaedi,"Lediri la go tšwelela ka modirišotlwaelo bjalo ka mo go 'Ka mehla re a dula, re theeletše dinonyana ge di opela' le hlaloša tirotlwaelo",,,,,,,,,,,,,,
unisa_multilingual_linguistic_terminology_464,habitual clause,,thabetlwaelo,,,,,,,,,,,,"thabe ye e nago le lediri ka go modirišotlwaelo, ye e sa emego ka boyona",Mo go 'Ba tsoga mesong ba apare' -  'ba apare' ke thabetlwaelo,,,,,,,,,,,,,,
unisa_multilingual_linguistic_terminology_465,habitual mood,,modirišotlwaelo,,,,,,,,,,,,"sebopego sa lediri se se laetšago ditiro tše di diregago ka mehla, ka tlwaelo","Mo go 'Ba mo tshwenya ka mehla, a lle' -  'a lle' ke popo ya modirišotlwaelo",,,,,,,,,,,,,,
unisa_multilingual_linguistic_terminology_466,head noun,,leinataodi,,,,,,,,,,,,leina leo mantšu a mangwe a sekafokoina a sa hlaolegego,Leinataodi la 'Monna yo maatla' ke monna,,,,,,,,,,,,,,
unisa_multilingual_linguistic_terminology_467,heretotonal homonym,,tumatshwano ya go fapana ka segalo,,,amagama abomphimbohluka,,amagama angophimbohluka,,,,,,,lentšu la go swana le le lengwe ka sebopego sa medumo eupša a fapana ka segalo le tlhalošo,Pela ya phoofolo le pela ya seletšo ke ditumatshwano tša go se swane ka segalo,,,,,Magama abizeka ngokufanako begodu atloleke ngokufanako kodwana aphinyiswa ngokuhlukileko nehlathululo yawo ayifani. Umehluko wawo uvela kuhle lokha nawasetjenziswako.,"Izakhi u-ya-, -za-, njll, zisiza isenzo bonyana siveze ikathi yokwenzeka kwesenzo.",,,amagama abhalwa noma apelwa ngokufana kodwa ebe esho izinto ezingefani ngenxa yokuphimiseka okungefani,amagama angophimbohluka mancane esiZulwini,,,,
unisa_multilingual_linguistic_terminology_468,homotonal homonym,,tumatshwano le ka segalo,,,magama abomabizwafane {Sifundo ngamagama afana nalawa: Inyanga,isifanekisozwi,omabizwafane abanetoni efanayo,,,,,,,"lentšu la go swana le le lengwe ka sebopego sa medumo le segalo, a fapana fela ka tlhalošo",Thaba ya leinantšu le -thaba ya kutudiri ke ditumatshwano tša go swana le ka segalo,,,,,Lawa magama abizeka ngokufanako begodu abhaleke ngokufanako kodwana abenomqondo ongafaniko / > yindulungu ekulu esemkayini ekhanyisa ebusuku. Inyanga > ngugobela olapha isintu.},,"igama elisetyenziselwa ukubhekiselela kuluhlu lwamagama anenkcazo enzulu nasetyenziselwa ukubonisa imiba eyahluka-hlukileyo efana nebala, ingxolo, ivumba, ungcamlo nezimvo, njalo njalo ngokunjalo ezinye izimo okanye iimeko",isifanekisozwi esithi 'hohlo' kwisivakalisi esithi: 'indlu ithe hohlo ngenxa kanogumbe' sibonisa indlela ewe ngayo indlu,amagama abizeka ngokufanayo futhi abhaleke ngokufana kepha ebe enomqondo ongefani,omabizwafane abanetoni efanayo bayinto engandile,,,,
unisa_multilingual_linguistic_terminology_469,honorific plural,,bontšitlhompho,,,,,,,,,,,,tirišo ya bontši go motho o tee e le go laetša tlhompho,Mo lefokong le 'Bokgoši ba fihlile' - hlogo ya bo- le lekgoasediri la ba- di laetša tlhompho go kgoši ka go mmitša ka bontši le ge e le motho o tee,,,,,,,,,,,,,,
unisa_multilingual_linguistic_terminology_470,hypernym,,lentšukakaretšo*,,,igama elengamele amagama womhlobo ofanako/ihayiphanimu,ixesha elisandul' ukudlula,igama elengamelayo,,,,,,,lentšu leo tlhalošo ya lona e akaretšago ditlhalošo tša mantšu a mangwe,"Noga ke lentšukakaretšo la mehuta ka koka ya dinoga, bjalo ka: mokopa, hlware, lerabe, legwere, bjalo bjalo.",,,,,igama elihlanganisa izinto zomhlobo ofanako,USobahle inyawo lakhe lingangelendlovu akafakelani nomuntu amanyathelo. Umutjhwana othi inyawo lakhe lingangelendlovu ulirhwala.,ixesha eliphambi kweladlulayo lokwenzeka kwesenzo,ixesha elisandul ukudlula lahlukile kweladlulayo,igama elifaka phakathi izinto eziningi zohlobo olulodwa,igama elengamelayo lingasetshenziswa emshweni,,,,
unisa_multilingual_linguistic_terminology_471,hyponym,,lentšukakaretšwa*,,,ihayiphonimu,ixesha langoku,igama elakha into eyodwa nelinye,,,,,,,lentšu leo tlhalošo ya lona e akareditšwego ka tlhalošong ya le lengwe le e lego la kakaretšo,Leeba ke lentšukakaretšwa la nonyane,,,,,igama lento elihlobene namanye ngaphasi kwegama elengamele izinto zoke ezihlobeneko.,"Igama elithi abantwana ligama elihlobene namanye angaphasi kwegama elithi abantu ekungilo elengamele yoke imihlobo yabantu, abesana, amadoda, iinlukazi, abafazi njll.","uhlobo lwexesha lezenzi olubalula izenzo ezihambelana nethuba lokuthetha (Louwrens, 1994: 81)",ixesha langoku lisebenzisa isakhi esahlukileyo kwesexesha elidlulileyo,amagama ezinto ezakha into eyodwa,igama elakha into eyodwa nelinye livezwe ngasekuqaleni komusho,,,,
unisa_multilingual_linguistic_terminology_472,hyponymy,,tlhalošokakaretšo,,,sifundo ngokuhlobana kwamagama,isakhi sexesha langoku,ukuhlobana kwamagama akha into eyodwa,,,,,,,kamanotlhalošo ye e lego gona gare ga mantšu a ditlhalošo tša ona di welago ka fase ga tlhalošo ya lentšu le tee,Tlhalošokakaretšo e re laetša ditswalano tše bohlokwa gare ga dikgopolo le mantšu; ka fao re kgona go bona gore nku le katse di tswalane ka ge bobedi e le diphoofolo,,,,,Sifundo ngamagama ahlobeneko siqalene namagama angamele woke amagama.,"Igama elithi abantwana ligama elihlobene namanye angaphasi kwegama elithi abantu ekungilo elengamele yoke imihlobo yabantu, abesana, amadoda, iinlukazi, abafazi njll.","isakhi segama u -a- esiluphawu oluqinisekisiweyo kwizenzi ezikuhlobo lokuqondisa nesifumaneka kwimo evumayo yexesha langoku/eladlulayo (Louwrens, 1994: 81)",kwigama elithi: 'Ndiyasabenza' u- 'ya' sisakhi sexesha langoku,ukuhlobana kwamagama asho izinto ezakha into eyodwa,ukuhlobana kwamagama akha into eyodwa kuyatholakala ezilimini eziningi,,,,
unisa_multilingual_linguistic_terminology_473,illocutionary act,,polelomaitshwaro ya tiro,Sento lesitsatsisako,,ukwethula ikulumo ngomnqopho othileko,okungangqalanga kokuthile,inkulumo eyethula injongo ethile,,,,,,,"tšhomišo ya lefoko go fa taelo, go botšiša potšišo goba go fa temošo, bj. bj. e le gore motheeletši a dire se sengwe",Lefoko le: 'Etšwang motseng!' Ke mohlala wa polelomaitshwaro ka ge le hlaloša se mmoledišwa a swanetšego go se dira,Sento lesentiwako sigcugcutela umlayeto losekucaleni .,Lesento sakhe sitsatsiswe esentweni seyise.,,,"Sisenzo esisetjenziselwa bonyana olaleleko enze okuthileko. Lokhu kufaka izenzo ezifana ukucolisa, ukuthokoza, ukuyelelisa, ukwamukela, ukuthatha isiqunto, njll.","Ikulumo ethi, Ukubamba ongaphasiisisitjho esitjho ukumangala.","inxenye (okanye udidi lweenxenye) engakwaziyo ukuchongeka ngokungqalileyo; ichasiswa ngokungqalileyo (Crystal, 2008: 241)",okungangqalanga kokuthile kuthetha ukuba akubhekisi kuko njengasesiNgesini u- 'a' akangqaliswa ntweni kanti u- 'the' ungqalisiwe.,ukusetshenziswa kolimi ukwethula injongo ethile,inkulumo eyethula injongo ethile ingasetshenziswa inoma ubani,,,,
unisa_multilingual_linguistic_terminology_474,inchoative verb,,lediriphetogo,Sentosisusa,,isilulo sesenzo u-al-,,isenzo esikhomba ushintsho,,,,,,,lediri le le laetšago phetogo sebopegong goba maemong a tiro,Lediriphetogo le laetša phetogo ye e bilego gona maemong a ditaba bjalo ka mo lefokong le: Motho o a nona,sento lesikhombisa kucala kwesimo,Sento sisusa sisiniketa umcondvo lowenabile ngelingemuva le menti nome mentiwa.,,,isilulo esele siyingcenye yesiqu sesenzo esingakwaziko ukwakha amagama amatjha.,Isibonelo: Ugogo kaDzwamari uyagula. Igama elithi kaDzwamari lingongumnini onqophileko.,,,isenzo esikhomba ukushintsa kwento isuka esimweni esithile iya kwesinye,isenzo esikhomba ushintsho sisetshenziswa kakhulu emakhaya,,,,
unisa_multilingual_linguistic_terminology_475,indigenous language,,polelo ya setšo,Lulwimi lwendzabuko,,,,,,,,,,,polelo ya lefelo le le itšego gomme e le ya setlogo sa batho ba fao,"Mo malemeng a semmušo a Afrika-Borwa, a senyane ke a setšo a Afrika mola a mabedi e le a setšo sa Yuropa / leleme la setšo",Lulwimi lwemdzabu lolukhulunywa bahlali besive lesitsite.,Kuhle kusebentisa lulwimi lwendzabuko nakufundziswa.,,,,,,,,,,,,
unisa_multilingual_linguistic_terminology_476,inflecting language,,leleme la inflekšene*,Lulwimi lolunetifakelo,,ilimi elitjhhugulula izakhi ngokwehlelo lelimi,ingingqi yesiyelelane,ulimi oluguqula izakhi ngokohlelo lolimi,,,,,,,"polelo ye sebopego sa lentšu se fetogago go ya ka diphapano tšhomišong ya lona, go ya ka popopolelo","Maleme a leloko la Batho, le ge e le a momagano ka tlhago, a na le dika tša inflekšene*",Luwimi lolusebentisa tifakelo kwentela kwakha kabusha emagama ngekufaka takhi letitsite  lekwenta kutsi inshokutsi ishintje,Tilwimiletinyenti tisebentisa tifakelo kwenta emagama / lulwimi lolugucukako,,,Ilimi elitjhugulula izakhi zegama ukuze zikhambisane nendlela igama elisetjenziswa ngayo emutjhweni.,Isibonelo: (i) Iyasetjenziswa njengebizo nofana njengesenzo.                                                             (a) Ukusebenza njengebizo:              Akusimnandi ukusebenza ungarholi ngefanelo.                                                             (b) Nayisebenza njengesenzo ivame ukusebenza nezingasenzo.                           Ufuna ukungenwa mkhuhlani,igama elisetyenziswa kwiziyelelane ukubhekiselela kwindawo ngokwezelizwe nebiyelweyo emephini ngokunjalo nephakathi kwemida apho isiyelelane esithile sithethwa khona,ingingqi yesiyelelane sesiMpondo iPhesheya kweNciba,ulimi oluguqula izakhi zegama ukuhambisana nendlela igama elisetshenziswa ngayo emshweni,isiNgisi siwulimi oluguqula izakhi ngokohlelo lolimi emshweni ukuhambisana nencazelo yayo,,,,
unisa_multilingual_linguistic_terminology_477,inflection,,popontšu,Kufakela,,ukutjhuguluka kwegama,,ukuguquka kwegama,,,,,,,tsela ya go oketša moselana lentšung goba go le fetola ka tsela ye nngwe ya melao ya popopolelo,Popontšu e fetola tlhalošo ya mantšu bjalo ka go hlomela moselana wa -ng mo leineng go le fetoša lehlathi,Indlela yekufaka takhi kumagama  emshweni lokushintja inshokutsi noma sikhatsi sesento,Lamagama lanikwe bafundzi atifakelo,,,"itjhuguluko legama elitjengisa ubunye nobunengi, nendlela yesenzo.",IsiNgisi lilimi elitjhugulula izakhi zegama emutjhweni ukuze zikhambisane nehlathululo yayo.,,,"ukuma kwegama ukukhomba ubunye nobuningi,  nendlela yesenzo",ukuguquka kwegama kungenzeka kunoma iliphi igama,,,,
unisa_multilingual_linguistic_terminology_478,interlocutors,,baboledišani,,,,,,,,,,,,batho ba ba kgathago tema mo poledišanong,Mo poledišanong go ba le mehuta ya go fapana ya baboledišani bjalo ka mmoledi le mmoledišwa,,,,,,,,,,,,,,
unisa_multilingual_linguistic_terminology_479,interpolation,,karoganego,,,ukuhloma igama phakathi kwamanye amagama,izimvo ngeelwimi,indlela yokuhlunga igama ngokugaxa igama enkulumeni,,,,,,,teko ya go kgaoganya karolo ye e itšego ya polelo go bona ge e ba ke lentšu la go ikema goba ga se lona,Karoganego ye nngwe ya diteko e re laetša phapano gare ga mantšu a tlwaelo le a linkwistiki,,,,,Indlela yokuhlunga igama ngokuhloma igama ekulumeni,Umuntu olaleleko lokha nakuthula ikulumo ungohlanganyeleko ekulumeni.,"izimvo abanazo abantu ngolwimi lwabo okanye ngolwimi okanye ngeelwimi zabanye  (Crystal, 2008: 266)",izimvo zabantu ngabanye malunga neelwimi zichatshazelwa zezoluntu ngokubanzi,ukugaxa igama phakathi kwamanye amagama yindlela yokuhlunga igama emshweni,indlela yokuhlunga igama ngokugaxa igama enkulumeni iyinto engajwayelekile ezilimini zeSintu,,,,
unisa_multilingual_linguistic_terminology_480,interrogative particle,,sekantšubotšiši,,,,,,,,,,,,dikarolo tša polelo tše e sego mantšu a go iphetša gomme  di šomišwa go botšiša,Mo lefokong le: 'Na le tlile ka eng?' - na ke sekantšubotšiši,,,,,,,,,,,,,,
