id,eng,sot,nso,ssw,ven,nbl,xho,zul,tsn,tso,eng_pos_or_descriptor,eng_pos_or_descriptor_info,sot_pos_or_descriptor,sot_pos_or_descriptor_info,nso_pos_or_descriptor,nso_pos_or_descriptor_info,ssw_pos_or_descriptor,ssw_pos_or_descriptor_info,ven_pos_or_descriptor,ven_pos_or_descriptor_info,nbl_pos_or_descriptor,nbl_pos_or_descriptor_info,xho_pos_or_descriptor,xho_pos_or_descriptor_info,zul_pos_or_descriptor,zul_pos_or_descriptor_info,tsn_pos_or_descriptor,tsn_pos_or_descriptor_info,tso_pos_or_descriptor,tso_pos_or_descriptor_info
unisa_multilingual_linguistic_terminology_116,ending,dumanotshi ya mokwallo,phetho,Nkhamisa logcinile,mitshila,ukamisa wokugcina,isolulo,unkamisa ogcinile,bokhutlho,xiheteleri,the final vowel in verbs and derverbatives,,dumanotshi ya ho qetela ho leetsi le maetsimatswa,"ho lereo ja, a ke dumanotshi ya mokwallo",karolo ya mafelelofelelo ya lentšu bjalo ka tumanoši ya mafelelo lediring,"Phetho ya lediri la Sesotho sa Leboa le le lego ka modirišopego, tumelo le lebjale ke -a",Ngunkhamisa logcinile esentweni noma egameni,Tento teSiswati tinaye nkamisa logcinile.,"ndi pfalandothe dza u fhedzisela kha maiti na maipfi o vhumbwaho a tshi bva kha maiiti. (Louwrens, 1994: 62)",tsimu yo limiwa yothe. Uyu nwana u a rwea. Rine ri a funana. / magumo,ukamisa wokugcina emagameni wesiNdebele,Iinkomo zikamalume zona zilahleke ngemangweni. Isabizwana u-sona ugandelela iinkomo zikamalume emutjhweni lo.,"isakhi segama esifakelwa emva kwengcambu yesenzi ukuze kuguqu-guqulwe intsingiselo yalo; ukuhlelwa kweentlobo zenguquko yentsingiselo, ngokubhekiselela  ekwenzeni banzi kwentsingiselo yegama elisetyenziswayo (Crystal, 2008: 181)",sisimava esifakelwa emva kwamagama ukuze kuguqu-guqulwe intsingiselo yawo,unkamisa wokugcina wesenzo emagameni esiZulu,unkamisa ogcinile ubhalwa njalo esenzweni,tumanosi mo lediring le mo madirimatsweng,,xitwari xo hetelela eka maendli na mapfeleri,xiheteleri xi kumeka emakumu ka nsinya wa rito
unisa_multilingual_linguistic_terminology_117,enumeratives,mabadi,,,,,,,,,constructions which are formed with a limited number of roots?,,dibopeho tse bopeletsweng le  palo e lekanyeditsweng ya dikutu,"polelwaneng, monna wa bobedi, wa bobedi ke lebadi",,,,,,,,,,,,,,,,
unisa_multilingual_linguistic_terminology_118,epistemic modality,kgonahalo ya tsebo,,,,,,,,,a theoretical framework for the analysis of modal verbs and related structures in language,,tlhophiso ya kgopolotaba bakeng sa manollo ya maetsi- mathusi le dibopeho tse amanang puong,ke dumela hore Covid -19 e tla fumanelwa pheko haufinyana,,,,,,,,,,,,,,,,
unisa_multilingual_linguistic_terminology_119,event time,nako ya ketsahalo,,Sikhatsi sesigameko/Sikhatsi sehlakalo.,tshifhinga tshiitei,,,,,nkarhi wa xiendleko,the time at which the reported eventuality takes place,,nako eo ketsahalo e tlalehuweng e etsahetseng ka yona,ho bohlokwa ho hlakisa nako ya ketsahalo ha o tletleba,,,Sikhatsi leso senteko senteke ngaso,Khetsiwe usibeke kahle sikhatsi sesento kulenkhulumo,"tshifhinga tshine zwithu zwo vhigwaho zwa fhedzisela zwo bvelela ngatsho (Savić, 2017: 46)",makhadzi vho da mulovha. Mvula yo na nga masiari. Tshikolo tshi dzhena nga awara ya vhumalo. / tshikhathi tshine mushumo wa bvelela nga tsho,,,,,,,,,nkama lowu xiendleko lexi vikiweke kuva xi humelerile hawona,nkarhi wa xiendleko wu na nkoka swinene eku twisiseni ka mhaka
unisa_multilingual_linguistic_terminology_120,expressive meaning,kutlwahatso ya moelelo,,Inshokutsi yalokukhulunywako,thaluso I si ya misi,umqondo oveza imizwa,,,bokao ba go itlhagisa,nhlamuselo ya nkombisaritwelo,"the expressive meaning of an expression refers both to its emotional content and to any identity it might have in terms of the personality  or individual creativity of the user (as in much poetic language). It is usually contrasted with descriptive and ‘social’ meaning. Other terms which overlap with ‘expressive’ include affective, connotative and emotive",,kutlwahatso ya moelelo ka maikutlo e bolela kgotsofalo ya maikutlo a teng le ho boitsebiso bo bong le bo bong boo e ka bang le bona ho ya ka semelo le boiqapelo ka bomong,ha a bua ka ho hlaka o kgona ho netefatsa kutlwahatso ya moelelo,,,Inshokutsi yenkhulumo leveta luvelo magama lolucuketfwe nguleyo nkhulumo,Inkhulumo yakho ayiyivete kahle inshokutsi. / Inchazelo leveta imiva,"thalutshedzo ine ya bvisela khagala kha hothe vhupfiwa na thaluso inwe na inwe ine ya nga vha nayo malugana na vhuvha kana vhutsila ha muthu ane a khou I shumisa (sa kha luambo lwa kha vhurendi vhunzhi). Kanzhi zwi fhambana na zwine thalutshedzo na zwine 'tshitshavha' tsha vha zwone. manwe maipfi ane a fhirana nga 'tsumedziso' a katela vhudipfi, zwine zwa amba na madipfele. (Crystal, 2008: 180)",Mashudu kha lufu lwa mme awe o vha a tshi khou renda o tungufhala. Maedza u khou fhufha nga dakalo nge a phasa mulingo wa gireidi 12. Nwana o ri u wa a tavha mukosi muhulu nga u pfa vhutungu. / vhudipfi/vhupfa,Yikulumo esebenzisa amagama akhombisa bona okhulumako akakathabi ngalokho okwenzekileeo.,"Ekulumeni ethi, Ilanga licimile, kusuke kuhlonitjwa umuntu  ohlonitjhwako emphakathini lokha nakahlongakeleko.",,,,,"bokao ba go itlhagisa ba polelwana e e kayang diteng tsa maikutlo le go ikitse go ya ka boitlhamedi ba bowena kgotsa ba bonosi ba modirisi wa puo jaaka mo puong ya ya poko. Ka gale e fapantshiwa le bokao ba tlhaloso kgotsa ba loago. Mareo a mangwe a a tsamaelanang le go itlhagisa a akaretsa kamego, kgatelelo le maikutlo","leboko le ke le buisitseng, le na le boleng bo bo thadisegang ba maikutlo",rito rin'wana na rin'wana kumbe xivulwahava lexi humeselaka matitwelo yo karhi ehandle,nhlamuselo yo kombisaritwelo yi tlhandlakanya na matheme yo tanihi rihlamuseri na man'wana
unisa_multilingual_linguistic_terminology_121,expressive utterance,ho bua ka maikutlo,,Inkhulumomivo,vhudipfi ha muambi,ikulumo ekhombisa ubujamo balowo okhulumako,intsingiselo yesafobe/intetho yesafobe,inkulumo eveza isimo sokhulumayo,polelo ya go itlhagisa,xivuriwa xa nkombisaritwelo,a type of utterance where the speaker expresses his or her feelings,,mofuta wa ho bua moo sebui se hlahisang maikutlo a sona,ha a halefile o kgona ho bua ka maikutlo ho feta ha a thabile,,,Inkhulumo lapho sikhulumi siveta imivo yaso,Inkhulumo yakhe ineluvelomagama lolubi / Inkhulumo leveta imiva,"ndi lushaka  lwa u amba lune muambi a vha a khou bvukulula kana u sumbedza vhudipfi hawe (Crystal, 2008: 180)","lufu lwa vhalwela mbofholowo lwo ri sia ro akhamala. Ndo ri u wana mushumo nda zwi pfa zwa uri vhusiwana mutani wa hashu ho fhela tshothe. Ndo bilufhala vhude, ngauri lufu ulwu lwa mme anga lwo bvelela nga murahu ha minwaha mivhili musi malume anga vho ri sia. / vhupfa ha muambi",Yikulumo esuselwa kilokho okwenziwe nofana okungakenziwa ngiloyo okhulumako.,"Bengingakakulindeli kuwe lokhu okwenzako, ungidanisile. Lekulumo iveza imizwa yalowo okhulumako","igama okanye ibinzana lamagama elisetyenziselwa ukufumana isiphumo sohlobo olulodwa nelingenantsingiselo yalo yesiqhelo okanye yentsusa (Richards and Schmidt, 2010: 219); .",intsingiselo yesafobe/intetho yesafobe isetyenziswa kakhulu kwimibongo,inkulumo esukela kokwenziwe noma kokungenziwanga yilowo okhulumayo,inkulumo eveza isimo sokhulumayo iyasicacisela ngemizwa yokhulumayo,mofuta wa polelo mop sebui se tlhagisang maikutlo a sona,"Reba o ne a thadisa maikutlo a gagwe mo go Tshego a re, 'ke a go bolelela, ga nkitla ke go thusa gape'",muxaka wa xivuriwa lexi haxona xivulavuri xi humeselaka ntwiwo wa xona erivaleni,xivumbiwa xa nkombaritwelo xi nga va xo tisa ntsako kumbe ku vaviseka
unisa_multilingual_linguistic_terminology_122,extension,katoloso,katološo,Selulo,mutshila,isinabiso/iinlungelelo {Isinabisi sesenzo sitjhugulula umqondo wesenzo. Isib. -thoba,izakhi zegama ezizimeleyo,iselulo,katoloso,xitsanyusi,"a morpheme which is added after the root of the verb to modify its meaning; the classification of types of semantic change, referring to a widening of meaning in a lexical item",,"noko e ekeditsweng kamora motso wa ketso ho ntlafatsa  moelelo wa yona; tlhophiso ya mefuta ya phetoho ya semantiki, e lebisitse ho bophara ba moelelo ntlheng ya mantswe",leetsi ahelwa ke katoloso ya leetsi aha,koketšo ya kutudiri ye e tsenago gare ga modu le moselanaphetho,Mabopi a bjalo ka -el- le -an- a bitšwa dikatološo,Sakhi lesifakwa  emuva  kwemsuka wesento kugucula inshokutsi.,Linyenti letimphambosi linetelulo,"ndi tshipida tsha ipfi tshine tsha tumiwa murahu ha mudzi wa liiti u shandikisa zwine ipfi la amba, ndi lushaka lwa khethekanyo ya tshanduko ya semantiki, ine ya amba thalutshedzo yo tandavhuwaho ya maipfi.",nwana o vhalela mme vhurifhi. Nwana o rungisa mme awe rokho. Tsimu iyi i a lemea. / ndapfiso,ingcenye yesenzo ethula umqondo ohlukileko esenzweni esisisekelo. / ukuthobela / > thobela = isenzo -thobela sesiveza umqondo wokwenzela omunye.},,"izakhi zegama ezinokwenzeka njengamagama ahamba odwa. Igama elinesakhi esihamba sodwa (esizimeleyo) libizwa ngokuba ligama elinesakhi esinye; (Crystal, 2008:313)",ulwimi lwesiNgesi luphawuleka ngezakhi zegama ezizimeleyo,isakhi esijotshelelwa ngemuva kwesenzo ukuguqula incazelo yesenzo,iselula sesenzo siguqula umqondo wesenzo,popi e e tsenngwang morago ga kutu ya lediri go fetola bokao,"re dirisa katoloso go tokafatsa bokao ba lediri, jaaka mo go 'lela' go 'lelang', 'lesea le le lelalang'",xinembeletwana lexi engeteleriwaka endzhaku ka nsinya wa riendli leswaku xi bumabumela nhlamuselo,xitsanyusi xi angarhela ntlawahato wa tinxaka ta ku cinca ka ntivonhlamuselarito
unisa_multilingual_linguistic_terminology_123,extensive morpheme,mofimi o atolositsweng,lebopikatološo,Sakhi lesiselulo,nyengedzo ya tshivhumbi,isakhi sokunabisa,,isakhi sokwelula,popi ya katoloso,xiakintsanyuso,,,"lentswe, kgolohadi ke mofimi o atolositsweng",,lebopi leo le tsenago gare ga kutudiri le moselanaphetho,Lebopi la lediregi (-eg-) re re ke la katološo ka gore ge le hlomelwa kutudiring ye bjalo ka -dula le tsena gare ga modu le moselana wa phetho gomme la katološa kutudiri yeo gore e be -dulega,Sakhi lesifakwa emuva kwelibito kukhoma bulili,Telulo tiyasita nawakha emagama latikhuliso.,ndi nyengedzedzo na livhumbi la tshifhinga tsho fhelaho -w-/-iw-; mitshila I tumetshedzwaho kha maipfi I shandukisa zwine ipfi la amba zwone kana kilasi ya ipfi la vhubvo ha tshipida tsha ipfi/ipfi (kana zwothe).,ro rengiselwa kholomo nga makhulu. Mbudzi dze dza vha dzo farwa musanda dzo la mavhele dzo rengululwa nga tshelede nnzhi. O laisilulelwa thundu nga vhathannga vha hawe. / ndadziso ya tshipida tsha ipfi,isakhi esisetjenziselwa ukunabisa umqondo wesenzo,Iinlungelelo zeempambosi ziziinabiso zezenzo. Isib UJeso wasifela esiphambanwenweni. Egameni wasifela u-el- osisakhi sepambosi yokwenzela usinabiso sesenzo.,,,isakhi esisetshenziselwa ukwelula umqondo wesenzo,isakhi sokwelula sifakwa ngemuva esenzweni,popi e e tsenngwang morago ga kutu ya lediri go fetola bokao,"fa re gokelela setlhongwa 'ng' mo lediring, lwala, jaaka mo go 'ngwana o a lwala, o robetse',  re oketsa bokao ba polelo mme popego e fetoga go nna, 'ngwana yo o lwalang, o robetse.'","xinembeletwana xo kala swipimelo, lexi pfumelaka ku nembeletiwa hinkwako",xiakintsanyuso i xinembeletwana xo angarhela
unisa_multilingual_linguistic_terminology_124,feminine suffix,sehlongwanthao sa botshehadi,moselana wa bongtshadi,Sijobelelo sebulili lobusikati,mitshila ya zwisadzi,isilungelelo sobulili besifazi,,isijobelelo sesifazane,setlhongwa sa botshegadi,xilandzi xa vusati,,,ke sehlongwanthao se fetolang kapa ho bonahatsa mantswe hore a hlahise botshehadi,"tau e tshehadi e bonahatswa ka sehlongwanthao sa botshehadi e eleng ""hadi"" ho bopa tauhadi",moselana wa go laetša gore motho goba selo ke se setshadi,"Mo leineng le mohlologadi, -gadi ke moselana wa bongtshadi",Sakhi lesijotjelelwako kute sikhombe bulili lobusikati,Sitawusebentisa takhi letelulako kwakha bulili lobusikati / Takhi tebufazane,ndi mitshila ine musi yo tumiwa kha dzina ya sumbedza mbeu ya tshisadzi.,ndoukadzi yo wela tivhani.  Makhadzi vho lima tsimu khulu. Mufumakadzi avha vha tou vha muhaga.,Sisakhi esikhomba ubululi besifazi esifakwa ngemuva kwegama.,"Iimpambosi zesenzo zoke zineenabiso. Isib. (i) Ipambosi yokwenzela, u-el- usinabisi        (ii) Ipambosi yokwenzisisa, u -isis- usinabisi",,,isakhi esikhomba ubulili besifazane esifakwa ngemuva kwegama,isijobelelo sesifazane sifakwa emabizweni,popi e e supang bong ba sesadi mo lefokong,"mo go 'kgosigadi o thusa bomme ba morafe',  setlhongwa sa bongtshadi, 'gadi', se gokeletswe mo leineng, 'kgosi' go bontsha bongtshadi",xiyimo xo va rito ri lungeleriwa xilandzi xo kombisa rimbewu,xilandzi xa vusati xo tanihi -kazi eka Hosikazi ritofularha ra Hosi
unisa_multilingual_linguistic_terminology_125,free morpheme,mofimi o lokolohileng,,,,isakhi esisodwa esakha igama,,isakhi esizimele,,,morphemes which can occur as separate words. A word consisting of a single (free) morpheme is a monomorphemic word,,mofimi o ka ikemelang jwalo ka lentswe. lentswe le nang le mofimi o le mong (o lokolohileng) ke lentswe le mofimi o le mong,thato ke mofimi o ikemetseng ho tswa ho lentswe thathohatsi,,,,,,,igama elinesakhi esisodwa,"Iimfenqo zithula ikulumo ebhacileko, nanzi ezivame ukusetjenziswa babantu: ukwenzasamuntu, irhwala, isifaniso, nesingathekiso.",,,imofimu esebenza yodwa njengegama eliphelele elinomqondo,isakhi esizimele asijwayelekile ezilimini eziningi,,,,
unisa_multilingual_linguistic_terminology_126,given information,tlhahisoleseding e fanweng,tshedimošo ye e filwego,Lwati loluniketiwe.,mafhungo o newaho,ilwazi elaziwako,izakhi ngokwegrama,ulwazi oludala enkulumeni,tshedimosetso e neetsweng,mahungu lama nyikiweke,"information already supplied by the previous linguistic context whereas ‘new’ information, as its name suggests, has not",,tlhahisoleseding e seng e fanwe ke boemo ba puo bo fetileng ho fapana le tlhahisoleseding 'e ntjha' e sokang e hlahiswa pele,ha ke hloke ho e phetha ka ha e le tlhahisoleseding e fanweng,tshedimošo ye mmoledi le mmoledišwa ka babedi ba nago le yona ka nako ya poledišano,Ge mmoledi a bolela ka sešupša se se boletšwego pele mo poledišanong a ka no šomiša lešala ka ge sešupša seo e le tshedimošo ye e filwego,Luhlobo lwelwati loluvele luniketiwe esimeni lesindlulile.,Inkhulumo yakhe iveta lwati loseluniketiwe.,"mafhungo ane o no bviselwa khagala nga zwe zwa ambiwa murahu he mafhungo 'maswa', sa zwe dzina la hone la dzinginywa, le la vha li sa athu u bviselwa khagala (Crystal, 2008: 211)","Tshimangadzo ndi a mudivhesa., zwavhudi-vhudi o vha thama yanga lwa minwaha mina. / mafhungo o fhiwaho",Ilwazi elaziwako ekhe lathulwa ngaphambilini.,IsiNdebele esikhulunywa eLimpopo sililimi lesigodi.,"izakhi zamagama ezisetyenziselwa ukuchaza ubudlelwane ngokwegrama phakathi kwegama nemeko yalo ekubhekiselelwe kuyo, ezifana nezesininzi okanye ezexesha elidlulileyo (Crystal 2008: 313)",izakhi ngokwegrama zezisetyenziswa ngokuchanekileyo ukwakha intsingiselo ephuhlileyo yamagama,ulwazi olwethulwe ngaphambili enkulumeni,ulwazi oludala enkulumeni lwethulwa isikhulumi,tshedimosetso ya bokaelo e e setseng e neetswe ke barutapuo ba pele mme tshedimosetso e ntšhwa ga e ise e ke e nelwe,"gore dikolo tsa naga ya rona di tswalelwe tsotlhe, ke tshedimosetso e e neetsweng ke puso","vuxokoxoko lebyi veke byi hlamuseriweke hi nhlamuselo ya xilingwistiki yo sungula eku sunguleni, kasi vuxokoxoko lebyintshwa tanihileswi vito ri vulaka, a byi sungulangi byi hangalasiwa","mahungu lama nyikiweke enhlengeletanini, ya kona eka tsalwa leri va nga hi nyika n'wexemu"
unisa_multilingual_linguistic_terminology_127,glottalic airstream mechanism,metjha ya tshebetso ya molatswana wa moya,tshepetšo ya moelamoya wa lešobakgokgokgo,Umgudvu wemoya wemphimbo,ndila ya muya ya golothaliki {p= pala,,,,setsamaisa mowa sa lelengwana,nkhuluko wa moya wa nkolo,"sounds made while the glottis is closed, and produced without the direct involvement of air from the lungs. Air is compressed in the mouth or pharynx above the glottal closure, and released while the breath is still held",,"medumo e etswang ha kodu e sa kwetswe, e hlahisitswe ntle le seabo se tobileng sa moya ho tswa matshwafong, moya o hatellwa ka molomong kapa mahalapeng hodima kwalo ya kodu, mme o lokollwe ha phefumoloho e ntse e tshwerwe",tlhahisong ya medumo moya o ka tswa kantle kapa wa kena ka hanong,"tiragalo ye e hlolago thibelo gare ga kgokgokgo le legano, gomme moya wo o pitlaganego moo wa tšwela ntle ka go thunya",Ge re ngwala sefonetiki re šomiša lenalana go swaya medumopolelo ya moelamoya wa lešobakgokgokgo bjalo ka [p'],Yindlela lapho umoya uphuma khona emphinjeni nakuphinyiswa.,Minyenti imisindvo lekhishwa ngemgudvu wemoya wemphimbo,"mubvumo une wa itwa musi golothisi lo valiwa, wa bvelezwa hu si na muya u bvaho mafhafhuni. Muya wo tsikekeledzwa mulomoni kana hanwani ntha tsini na golothala, wa bviswa musi mufemo u tshe wo kwanyeledzwa. (Crystal, 2008: 213) / > vhasidzana vho ya u pala muroho tsimuni. T=tama> ndi khou tama maswiri. K= kala > Lufuno u kala nwana musi vha tshi shuma. / ndila ya muya ya gulokulo}",,,,,,,,ke medumo e e diriwang fa lelengwana le tswetswe mme e tlhagisiwa  kwa ntle ga tiriso ya mowa o o tswang kwa makgwafong ka tlhamalalo mme mowa o pitlagantswe mo leganong kgotsa mo kgogobeng e e fa godimo ga setswalo sa lelengwana mme wa lokololwa mowa o santse o tshwerwe,"mo go, 'go sa direng ga ga Mohau, go mo fetotse mohumanegi', 'h', mo go Mohau le mohumanegi, di tlhagisiwa ka  ditsamaisi tsa kelamowa tsa kgokgotso",mipfumawulo leyi vumbekaka loko nyangwa wa kholokholo wu pfulekile naswona wu vumbiwa handle ko nghenelelana na moya wo suka emahahwini,nkhuluko wa moya wa nkolo wu humelela eka lakalaka na le ka nyangwa wa kholokholo
unisa_multilingual_linguistic_terminology_128,grammatical agreement,tumellano ya thutapuo,kwano ya popopolelo,Kuvumelana ngekwelulwimi,girama kwayo,isivumelwano,umabizwafane,imvumelwano,tumalano ya thutapuo,vutwananisi bya vuvulavuri,a formal relationship between elements,,kamano e molaong pakeng tsa dikarolo tsa puo,"tshebediso ya ba, ka mora lebitso bana, e tlisa tumellano ya thutapuo",peakanyo ye e hlolwago ke makgokedi go kwantšha dikarolo tša lefoko,"Ge kwano ya popopolelo e šarakane, lefoko le ka se kwagale; kwano ya popopolelo ya tlwaelo ke: sediri-lediri-sedirwa",Lokukusho kuvumelana kwetitfo letakha umusho,Lemisho iyavumelana ngekweluhlelo lwelulwimi,"ndi vhushakaho doweleaho vhukati ha zwivhumbi zwa maipfi, (Crystal, 2008: 18)",mutukana o la vhuswa. musidzana u khou linda mapfene. Nowa yo shavhela mulindini. / thendelano ya phendaluambo,isakhi esiletha ubudlelwana  phakathi kwegama nokhunye okukhambisana nalo.,Kuneencwadi zehlelo nezokupeledwa kwamagama ezatlolwa bosolwazi belimi ukuze abakhuluma ilimi lelo babe nelwazi ngalo.,uxela igama elifana nelinye elinolwakhiwo olufanayo nelinye kodwa ahluke ngentsingiselo (Crystal 2008: 231),ithanga' elithetha ilungu lomzimba lingumabizwafane ka- 'ithanga' othetha umfuno otyiwayo,isakhi esiletha ubudlelwano noma ukuvumelana phakathi kwamagama emshweni,imvumelwano isebenza ngezindlela eziningi emshweni,botsalano bo bo tlhomamemng magareng ga dielemente,"mo go 'Mapula le basimane, ba ya ditshwantshong', go na le kgolagano ya thutapuo ka go dirisa thuanyisediri 'ba', mo go 'ba ya ditshwantshong' gonne leina, 'basimane', le mo bontsing mme le gaufi thata le 'ba'",vuxaka bya ximfumo exikarhi ka swiphemu swa nkoka,utwananisi bya vuvulavuri byi humelela loko rito ri cinca xivumbeko exivulweni
unisa_multilingual_linguistic_terminology_129,grammatical morphemes,dimofimi tsa thutapuo,,Sakhi lesifakwako,zwivhumbi zwa girama,,,,dipopi tsa thutapuo,swiakivuvulavuri,,,"dimofimi di sebedisitswe ho hlakisa dikamano tsa thutapuo dipakeng tsa lentswe le dikahare tsa lona, jwalo ka bongata le lekgathe lefitile",dihlongwanthao le dihlongwapele ke dimofimi tsa thutapuo,,,Sakhi lesifakwa kute sivete budlelwano emkhatsini kweligama nendzawo,Sitawufaka takhi letemukelekako ngekweluhlelo lwelulimi,"zwipida zwa maipfi zwine zwa shumiswa u sumbedza vhushaka ha girama vhukati ha ipfi na hune la shuma hone, sa vhunzhi kana a tshifhinga tsho fhiraho  (Crystal 2008: 313)",vhatukana vho via mbudzi. Tshitaha tsha tshinoni. Maswiri aya ndi anga. / phendaluambo ya zwipida zwa maipfi,,,,,,,dipopi tsa thutapuo tse di dirisiwang go bontsha kamano magareng ga lefoko le tiriso le bokaelo jaaka bontsi kgotsa pakafetileng,"dipopi tsa thutapuo tse di dirisitsweng mo go, 'mosese wa me o utswitswe', ke, wa me =lerui, o=thuanyi sedirwa mo bongweng, utswitswe= lediri mo paka fetileng","swinembeletwana leswi tirhisiwaka ku humelerisa vuxaka bya vuvulavuri lebyi nga kona exikarhi ka rito na leswi ri vulaka swona, xiyimo xa rona xo tanihi vunyingi kumbe nkarhi lowu nga hundza","swiakivuvulavuri swi katsa swirhangi, swilandzi na swin'wana"
unisa_multilingual_linguistic_terminology_130,grammaticalisation,popehofatso-puo,popopolelofatšo,Luhlelomagama,tshumiseo kwayo ya maipfi {kha ri tuwe,,,,thutapuofatso,vuvulavurihati,the change by which lexical categories become functional categories,,phetoho eo mekgahlelo ya moelelo e bang mekgahlelo ya tshebetso,karolo ke popehofatso-puo ya lentswe arola,tiragalo ye go yona dikarolo tša polelo tša maemo a ka godimo bjalo ka mantšu di lahlegelwago ke maemo a tšona gomme tša fetoga tša maemo a ka fase bjalo ka mabopi,Mabopi a bjalo ka la kgonego la '-ka-' le la letlago la '-tla-/-tlo'- a tlogile maemong a godimo a go ba mathuši a tla maemong a fase a go ba mabopi,Ingucuko lapho emagama lacuketse umcondvo aba magama lasetjentiswako,Doke ubhale emagama ngekweluhlelomagama / Takhi telulwimi,"ndi tshanduko ine khethekanyo ya ndivho ya maipfi ine ya do vha khethekanyo ya mishumo ya maipfi. (Hapelmath, 1999: 1043) / > nne na inwi kha ri tuwe. Tsinani > inwi tshinani. / mavhekanyele a luambo}",,,,,,,,diphetogo tse ka tsona magoro a mafoko a fetogang go nna magoro a tiriso,"mo polelong e, 'malome o gama yona', go dirisitswe tsamaisano ya thutapuo /tswanafatso gonneleemedi, 'yona', le emetse leina 'kgomo'",ncinco lowu vangaka leswaku swiyenge swa marito swi cinca swi va swiakivuvulavuri,vuvulavurihati byi nga kurisa kumbe ku hunguta rito
unisa_multilingual_linguistic_terminology_131,heretonal homonyms,modumo/sehalo di a tshwana/fapana,,,,,,,,,words which have the same sound pattern. Which also have the same tonal patterns but which differ in meaning,,"mantswe ao a nang le phethene ya modumo e tshwanang, ao hape a nang le phethene e tshwanang ya sehalo empa a fapane ka moelelo","tsotsi e ile ya tlola terateng e fasitsweng ka thata, ntate o tlola matsoho ka mafura",,,,,,,,,,,,,,,,
unisa_multilingual_linguistic_terminology_132,heteronymy,sekadumashwano,,Bomcondvonyenti,hethoronimi,,,,bokwalotshwano,,"the analysis of words (lexemes) which display partial homonymy, i.e. they differ in meaning, but are identical in form in one medium only (viz. speech or writing). Examples of heteronyms would be the homographs row (sc. a boat) and row (sc. noise), or",,"manollo ya mantswe (dilekseme) tse bontshang karolwana ya dihomonimi, ke hore a fapana ka moelelo empa a tshwana sebopeho feela (puo le ho ngola), mehlala ya dikatumatshwano e ka ba mola wa homokerafo ( seketswana) le (sc. lerata), kapa homofounu akgetse le ka hara",palo ya nomoro le palo ya ho bala buka ke dikadumatshwano,,,Emagama lafanako kepha abe nenshokutsi lengafani,Banengi bomcondvomnyenti kulolulwimi,"tsenguluso ya maipfi (mbekanyo ya maipfi)  ine ya sumbedza tshipida tsha homonimi, dzo fhambanaho zwine zwa amba zwone, fhedzi dzine dza vhumbwa u fana nga ndila i fanaho ( kubulele kana kunwalele). Tsumbo ya hetheronimi I do vha homogirafu (gungwa) na muduba (phosho), kana dzi homofounu dzo rumelwa dza tahekanya. (Crystal, 2008: 227)",maipfi a re na mibvumo I no fana a re na thalutshedzo dzo fhambanaho,,,,,,,tshekatsheko ya mafoko a a bontshang bodumatshwano bo bo sa felelang ke gore a farologana ka bokao fela a tshwana ka popego e ka nna ka puo kgotsa mokwalo.,"lefoko, 'noka', le na le botumotshwano ba segalo se se farologaneng, jaaka fa o re ' mme o itshwere noka' , go farologana le fa o re 'metsi a noka a kgadile'","nhlahluvo kumbe ntlhantlho wa marito lama ma kombisaka kuva na vufanapeletwananyana, hi leswaku ma hambana hi tinhlamuselo kambe ma fana hi xivumbeko",mafanapeletwa ya matwariselo yo hambana yo tanihi sindza (ndhawu)  na sindza ( xoambala evokweni) lama ma hambanaka hi matwariselo
