id,eng,sot,nso,ssw,ven,nbl,xho,zul,tsn,tso,eng_pos_or_descriptor,eng_pos_or_descriptor_info,sot_pos_or_descriptor,sot_pos_or_descriptor_info,nso_pos_or_descriptor,nso_pos_or_descriptor_info,ssw_pos_or_descriptor,ssw_pos_or_descriptor_info,ven_pos_or_descriptor,ven_pos_or_descriptor_info,nbl_pos_or_descriptor,nbl_pos_or_descriptor_info,xho_pos_or_descriptor,xho_pos_or_descriptor_info,zul_pos_or_descriptor,zul_pos_or_descriptor_info,tsn_pos_or_descriptor,tsn_pos_or_descriptor_info,tso_pos_or_descriptor,tso_pos_or_descriptor_info
unisa_multilingual_linguistic_terminology_264,qualificative,e lokafatsang,tlhaodi,Sichasiso,Vhutaluli,isihlathululi,amagama anamalungu amane,isichasiso,tlhaodi,ribumabumeri,a term used to refer to any word or word group which qualifies a noun,,lereo le sebedisitsweng ho lebisa ho lentswe le leng le le leng kapa sehlopha sa lentswe se lokafatsang lebitso,"mofumahadi ya botswa o ratwa ke setjhaba (ya botswa, e lokafatsa lebitso mofumahadi)",legorontšu le le šomago go oketša tlhathollo ya leina goba ya lentšu le le šomišitšwego sebakeng sa leina,"Lehlaodi, lerui le leamanyi ke mehuta ya tlhaodi",Ligama lelichaza kabanti nga sobito.,Sichasiso ngiso lesitawusitjela kabanti ngalokwetekako.,Themo I shumaho u sumba ipfi linwe na linwe kana tshigwada tsha maipfi tshi talulaho dzina.,,licezu lekulumo elisitlhadlhula ngebizo emutjhweni.,"Nasikhuluma ngesihlathuli sikhuluma ngamagama asitjela kabanzi ngebizo ekungilawa: isiphawulo, isibaluli, inani, ubumnini/ubunikazi","amagama akhiwe ngamalungu amane (Louwrens, 1994: 157)",igama elithi: 'u-m-thwa-lo' linamalungu amane,ucezu lwenkulumo olusitshela kabanzi ngebizo emshweni,izichasiso zisitshela kabanzi ngoSobizo,lereo le le dirisiwang go kaya lefoko lengwe le lengwe kgotsa setlhopha sa mafoko a a tlhaolang leina,"fa re re, 'ngwana yo o sa leleng, o swela tharing', 'yo o sa leleng',  ke tlhaodi, e e tlhaolang, leina, 'ngwana'",thema leri tirhisiwaka ku vula rito rin'wana ni rin'wana kumbe  mitlawa ya marito leri/leyi bumabumelaka riviti,"ribumabumeri ra rihlawuri eka ririmi ri tirha ku kombisa vukulu, nkoka xikan'we na ntsengo wa leswi swi bumabumeriwaka"
unisa_multilingual_linguistic_terminology_265,qualifier/qualifying word,selokafatsi/lentswe le lokafatsang,,Lelisichasiso,Ipfi line la talula,,,,lefoko la tlhaodi,rito leri bumabumelaka,"any word which qualifies (i.e. which provides more information about) a noun in a sentence (Lourens, 1994: 159)",,lereo  le sebedisitsweng ho lebisa ho lentswe le leng le le leng kapa sehlopha sa lentswe se lokafatsang lebitso,"monna e motenya o rata bana ba hae (e motenya, ke selokafatsi se bitswang lekgethi)",,,Noma nguliphi ligama lelisebente njengesichasiso emshweni.,Onkhe emabito lasetjentiswe njengesichasiso ayalichaza libito.,Ipfi linwe na linwe line la talula dzina fhungoni.,Munna muhulu o da.,,,,,,,"lefoko lengwe le lengwe le le tlhalosang ke gore, le le nayang tshedimosetso e ntsi ka ga leina mo polelong","letlhaodi mo polelong e, 'mosadi yo mokhutshwane thata o fitlhile', ke 'thata' gonne e gatelela bokao ba tlhaodi, 'yo mokhutshwane'",rito rin'wana na rin'wana leri ri hlamuselaka riviti exivulweni hi ku enta,rito leri bumabumelaka ri nga landza kumbe ku rhangela leri bumabumeriwaka
unisa_multilingual_linguistic_terminology_266,quantitative pronoun,leemedipadi,lešalapadi,Sabito sekubala,Lisala la litaluli,isabizwana sokubala,isimelabizo soquko,isabizwana sokubala,leemeditlhophi,masivintalo,"<those pronouns which express the meaning 'all' or the 'the whole of' Louwrens, 1994:159)>",,maemedi ao a utlwahatsang moelelo 'kaofela' kapa 'kaofela ha',"bana bohle ba ile ba sekolong (lentswe bohle, le utlwahatsa moelelo 'kaofela')",lešala la go emela kakaretšo ya dilo tše go bolelwago ka tšona,Lešalapadi ke leina le lengwe la lešalagohle gomme le tsebja ka modu wa -ohle / lešalagohle; lešalaohle,Tabito letiveta umcondvo wekubala enkhulumeni.,Sabito sekubala siyadzingeka nasifuna linani.,Lisala la litaluli.,Vho da vhothe matsheloni.,"Isabizwana sokubala sisebenzisa iziqu ezilandelako, -ke, -dwa-, bili, -thathu, -ne, -hlanu.","Abantwana bakhambe bobathathu baya esitolo. Kilomutjho igama elithi, bobathathu lisisabizwana sokubala.","<ezo zimelabizo ezichaza intsingiselo 'ngokupheleleyo' okanye 'okupheleleyo kokuthile nokuba kokukodwa' Louwrens, 1994:159)>",isimelabizo soquko siligama eliqukayo elimela isibizo njengo- lonke kulo mzekelo: 'lonke uluntu luthetha ngazwinye',"isabizwana esisho esineziqu -nke, -dwa, -bili, -thathu, -ne, -hlanu","izinkomo zozine ziphume esibayeni, igama elithi zozine kulo musho liyisabizwana sokubala",maemedi ao a tlhagisang bokao botlhe kgotsa gotlhe,"mo polelong, 'ke reketse bana botlhe ditlhako', 'botlhe' ke leemeditlhophi",masivi lama ma humeselaka nhlamuselo hi xitalo kumbe hi ku hetiseka,eka Xitsonga ku na tinxaka tinharhu ta masivintalo
unisa_multilingual_linguistic_terminology_267,question types,mefuta ya dipotso,mehuta ya dipotšišo,Tinhlobo temibuto,Tshaka dza mbudziso,,,,mefuta ya dipotso,tinxaka ta swivutiso,"types of questions which may occur in a language (Louwrens, 1994: 160)",,mefuta ya dipotso e ka etsahalang puong,"dipotso tse ka botswang tse ding di batla hore moithuti a fane ka lesedi le le ngata, ha tse ding di sa hloke dikarabo, jwalo ka o jele, papisong le hobaneng o sa ja?",mehuta ya go fapana ya dipotšišo ye e dirišwago polelong,Mehuta ya dipotšišo e tsebja ka dipharologantšho tša popantšu,Tinhlobo temibuto letingabakhona elwimini.,Loluhlobo lwembuto alukatayeleki.,Tshaka dza mbudziso dzine dza vha hone kha luambo.,,,,,,,,mefuta ya dipotso tse di ka tlhagelelang mo puong,o tshwanetse go tlhaloganya mofuta wa potso pele o ka kgona go e araba,tinxaka ta nkonaniso lowu humelelaka eka ririmi,tinxaka ta swivutiso leswi nga kona eka ririmi
unisa_multilingual_linguistic_terminology_268,recipient language,puo e amohelang,polelo ye e amogelago,Lulwimi lwemlaleli,Luambo lutanganedzi,ilimi elibolekako,,ulimi olubolekayo,puo ya moamogedi,ririmi ra vaamukeri,"a language which takes in items (words, sounds, etc.) from another language (the donor or source language) (Crystal 2008: 404)",,"puo e nkang/amohelang diaetheme (mantswe, medumo jwalojwalo) ho tswa puong e nngwe (mofani/moabedi kapa mohlodi wa puo)",puo ya rona ya Sesotho e adima mantswe ho tswa puong tse ding,polelo ye e amogelago lentšu go tšwa go ye nngwe,Leadingwa ge le tsena polelong ye e amogelago le ka dula hlenkge ka go swana goba go nyaka go swana le mantšu a mangwe a polelo yeo ka lenaneo la medumo,Lolulwimi lolutsatsa emagama noma umsindvo kulolunye lulwimi.,Umdzeshi usebentise lulwimi lwemlaleli kuchaza lafuna kwenteke.,"maipfi,mibvumo, nz. / <Luambo lu dzhiaho u bva kha lunwe luambo(lupambwaho kana luambo lwa vhubvo.>",,ilimi eliboleka amagama kwamanye amalimi,IsiNdebele lilimi elibolekako ngombana linamagama eliwaboleke kamanye amalimi.,,,amagama asuselwa kolunye ulimi asetshenziswa olimini olubolekayo,isiZulu ulimi olubolekayo ngoba sinamagama abolekwe kwezinye izilimi,puo e e amogelang mafoko kgotsa medumo go tswa mo puong e nngwe jaaka puo ya moabi kgotsa motswedi,Setswana ke puo ya moamogedi ya maadingwa a le mantsi a SeAforikanse,"ririmi leri amukelaka swo karhi (marito, mipfumawulo, nsw) swo huma eka ririmi rin'wana (ririmi ra munyikeri kumbe ra xihlovo)",ririmi ra vaamukeri i ririmi leri  tindlandlamuxaka hi ku lomba marito na mipfumawulo
unisa_multilingual_linguistic_terminology_269,reciprocal,leetsani,ledirani,Impambosi yekwentana,Liitana,ipambosi yokwenzana,ulwimi olungumamkeli,impambosi yokwenzana,,xihlamulano,indicates that two or more persons or things are mutually involved in the action,,le supa hore bobedi kapa ho feta ha batho kapa dintho di na le seabo ka kutlwano ho ketso,bashanyana ba otlana ka majwe,lediri le le nago le moselana wa -an-,Lediri le lebjalo ka ratana le bitšwa ledirani,Imphambosi lekhombisa kwentana kwetintfo letimbili nome letengcile.,Imphambosi yekwentana ayikho kulomusho.,U sumbedza uri vhathu vhavhili kana vhanzhi kana zwthu zwi khou bveledza nyito I tshi bva masia othe.,Vhatukana vha khou rwana.,Sisenzo esisuselwa kwesinye isenzo esikhomba ukwenzana.Isenzo esisepambosini yokwenzana sibonakala ngesakhi u-an-,"Isibonelo: Kilomutjho, Abantwana bafundisana ukudlala ibholo ngaphandle.                                        Egameni elithi, bafundisana,isakhi u-an- uveza isenzo sokwenzana.","ulwimi olwamkela iinxenye (amagama, izandi, njalo njalo) kolunye ulwimi (olungumnikeli okanye ulwimi oluyintsusa) (Crystal 2008: 404)","isiXhosa lulwimi olungumamkeli malunga namagama afana no-ifesitile, itafile namanye kuba ayengekho kolu lwimi mandulo",isenzo esisuselwa kwesinye isenzo esikhomba ukwenzana,ukusebenzisana kuveza ubuhle obulethwa yisenzo esisempambosini yokwenzana,,,kombisa leswaku vanhu vambirhi kumbe ku tlula va le ku endleni ka swo karhi hi ku tlheriselana,"rhavi ra xihlamulana, leri ri vonakaka hi xilandzi -ana"
unisa_multilingual_linguistic_terminology_270,reduplication,phetapheto,poeletšo,Kuphindzaphindza,Ndovhololo,ukuphindaphinda,isixando sokwenzana,ukuphindaphinda,,mbuyelelaxiaki,"a process of repetition whereby the form of a prefix/suffix reflects certain phonological characteristics of the root (Crystal, 2008:407)",,tshebetso ya phetapheto moo sebopeho sa sehlongwapele/sehlongwanthao se bontshang makgetha a itseng a fonoloji ya motso,banna ba bararo ba tshwasitse ditlhapi (ba e phetaphetuwe polelong ena),popego ya go boeletša lentšu goba karolo ya lentšu,Popego ya poeletšo ya kutudiri e boeletša kutu yeo ka moka bjalo ka -kitimakitima,Indlela yekuphindzaphindza emagama emshweni noma enkhulumeni tsite.,Kulemisho kuphindzaphindvwe sicu.,Ndovhololo ine khayo tshivhumbeo tsha thangi/mutshila wa sumbedza tshanduko ya zwitalusi zwa mudzi.,,ukuphindphinda kusetjenziswa ekulumeni nakuvezwa umbono othileko ebaleni.,"Velaphi, Velaphi! Ukuphindaphinda lapha kuveza bonyana kukhona okuthileko okwenziwe nguVelaphi, okungabakuhle nofana kudanise.",sibonisa ukuba abantu ababini okanye ngaphezu koko nokuba zizinto zibandakanyeka ngobambiswano  ekwenzeni okuthile,isixando sokwenzana sibonisa isenzo sokwenzana njengokuthi: 'ukuthandana',ukusetshenziswa kwamagama noma amabinzana aphindiwe ukugqamisa umbono othile,Mntanami! Mntanami!  Ukuphindaphinda okutholakala esihlokweni senoveli eliphathelene nokungalaleli komntwana iziyalo zabazali.,,,i maendlelo yo vuyelela laha xivumbeko xa xirhangi/xilandzi ma kombisaka xivumbeko xin'wana xa sayense ya swa ntivomipfumo eka rimitsu,"""-elel-"" i mbuyelelaxiaki ka rito ra dlayetela"
unisa_multilingual_linguistic_terminology_271,reference,tshupiso,tšhupo,Umtfombolwati,Referentsi,ireferensi,uphinda-phindo,ireferensi,,xiyelaniso,"a term often used to state a relationship of identity which exists between grammatical units, e.g. a pronoun refers to a noun or noun phrase (crystal, 2008:407)",,"lereo le sebedisitsweng kgafetsa ho bolela kamano ya boitsebiso e teng dipakeng tsa diyuniti tsa kerama; mohlala, leemedi le lebisitse ho lebitso kapa polelwanalebitso",badisana ba disitse tsane (tsane e supa ho dikgomo),kamano magareng a lentšu (e lego karolo ya polelo) le selo (e lego karolo ya lefase),Lentšu le molete ke leinantšu le le  yona ya seo [molete] e lego sona ka tlhago,Umtfombo lekutatjwe kuwo lwati.,Minyenti imitfombolwati longayivakashela nawenta lucwaningo.,themo ine kanzhi ya shumiswa u amba vhushaka kana u fana hune ha vha hone vhukati ha zwipida zwa girama.,,budlelwana phakathi kwegama nalokho eliqalise kikho epilweni.,"Umgwatjha ligama elinqophise esilwaneni semangweni nofana ehlathini esidliwako, esinoboya esikhamba ngemilenze emine.","inkqubo yokuphinda-phinda apho uhlobo lwesimaphambili/isimamva sibonisa iimpawu ezithile zengcambu ngokwefonoloji  (Crystal, 2008:407)",igama elithi uphinda-phindo lingumzekelo wokuphinda-phindwa kwesiqu segama,ubudlelwano phakathi kwegama olimini nalokhu elibhekise kukho empilweni,igama elithi inja olimini libhekise esilwaneni esifuyiwe esinoboya futhi esihamba ngemilenze emine,,,"i theme leri mikarhi yo tala ri tirhisiwaka eka xiyimo xa vuxaka bya xihlawulekisi lebyi humelelaka exikarhi ka swiyenge swa ririmi, xk: risivinene ri kongomisa eka riviti kumbe xivulwa xa riviti",1 mudyondzisi wa yena u n'wi nyikile papila ra xiyelaniso 2 u xaxametile mudyondzisi wa yena wa khale tanihi xiyelaniso loko a endla xikombelo xa ntirho
unisa_multilingual_linguistic_terminology_272,reference time,tshupo ya nako {morena o lema masimo ha tadi e antsha (ha tadi e antsha e lebisitse nakong eo ketso e etswang ka yona},,Sikhatsi ngco,Tshifhinga tsha referentsi,,,,nako ya bokaedi,nkarhi wa xiyelaniso,,,,,,,sikhatsi lekucondziswe kuso.,Sikhatsi sesenteko ngiso lesisikhatsi ngco kulenkhulumo.,Tshifhinga tsha referentsi.,,,,,,,,nako e tiragalo e e kaiwang e diragetseng ka yona,"fa o re 'legadima le rathile ka letlatlana', ka letlatlana ke nako ya bokaedi",,nkarhi wa xiyelaniso wu kongomisa eka nkarhi lowu nghingiriko wu humelelaka ha wona
unisa_multilingual_linguistic_terminology_273,referent,sesupo,sešupša,Lokucondziswe ku…,Tshisumbwa.,ireferenti,ixesha lokubhekiselela kokuthile,ireferenti,bokaetso,xikongomiwa,"the entity which is denoted by a reffering expression;a term used in philosophical linguistics and semantics for the entity (object, state of affairs, etc.) in the external world to which a linguistic expression relates (Crystal, 2008: 408)",,"karolo e hlalositsweng ka ponahalo e lebisang; lereo le  sebedisitsweng thutapuong ya filosofi le disemantiki bakeng sa karolo (ntho, boemo ba ditaba jwalojwalo) ho lefatshe kantle eo ho yona  ponahalo ya puo e amanang",ho tlolatlola ha ngwana ke sesupo sa hore o thabetse ho bona batswadi ba hae,selo se se bonagalago goba se sa bonagalego seo se bitšwago ka leina,Sešupša mo lefokong se emelwa ke leina goba legorontšu le lengwe le le kgonago go šoma sebakeng sa leina,Intfo lekungiyo lekucondziswe kuyo enkhulumeni.,Lenkhulumo icondziswe ngco  kubafundzi .,Tshithu tshine tsha khou sumbwa,,into igama nofana umutjhwana oqalise kiyo,Igama elithi ikukhu liqalise emhlobeni wenyoni efuywako enemilenze emibili.,ixesha lokwenzeka kwesenzo ngokwezifundo zegrama,ixesha lokubhekiselela kokuthile libalulwa ngokwexesha lesenzo njengakwigama elithi: 'wayefunqule' apha: 'Umama wayefunqule umntwana',igama noma ibinzana  elibhekise entweni ekhona ngaphandle olimini,"igama elithi inja lisho isilwane esifuyiwe esinoboya, esihamba ngemilenze emine esikhona empilweni","se se kaiwang ke thadiso e e kaelang; 
lereo le le dirisiwang mo filosofing ya borutapuo le bokaopuo ka sengwe  ka kwa ntle ga se thadiso ya borutapuo bo amanang le lona","mo polelong, 'mme o biditse wena', bokaetso ke mmuisiwa e bong, 'wena'","noun / <xan'wanchumu lexi hlamuseriweke hi nhlamuselo yo kongomisa; theme leri tirhisiwaka eka swiyenge swa tindzimi ta swa vuhleketi ka xanchumu (xiendliwa, xiyimo xa timhaka,",sw) eka matiko ya le handle laha eka swona na nhlamuselo ya ririmi swi yelanaka> {1 tinhlamuselo timbirhi to hambana ti nga ha va ni xikongomiwa xo fana 2 xikongomiwa i nchumu lowu rito ri vulaka wona}
unisa_multilingual_linguistic_terminology_274,referrring expression,ponahalo e lebisang ho ho hong,lentšutšhupi,Inkhulumo lesho lokukhona,Gute/vhuthihi,ukutjho okuqalise kokuthileko,ekubhekiselelwa kuko,,,xikongomi,"any word, word group or phrase which denotes an entity in the real world (Louwrens, 1994:166)",,"lentswe le leng le le leng, sehlopha sa lentswe kapa polelwana e hlalosang karolo e lefatsheng la nnete",dipapadi ke diketsahalo tseo batho ba ikgathollang ho tsona,"lentšu, sehlophantšu goba sekafoko se se nago le tlhalošo yeo ka kakaretšo e šupago selo mo lefaseng",Lentšu la go swana le thipa ke lentšutšhupi ka ge le šomiwa go šupa selo se se lego gona lefaseng,Inkhulumo lephatselene nanomayini lekhona emhlabeni.,Asingete sakucedza lekukhona emhlabeni jikelele.,"Ipfilinwe na linwe,tshigwada tsha maipfi kana lifurase li sumbedzaho u fhelela ha tshithu kha shango la vhukuma.",,yikulumo esetjenziselwa ukuqalisa okuthileko emuntwini nofana entweni ethileko.,"UNdunakulu weTjhingalanga Kapa, kule kulumo kuqaliswe ku-Allen Windy","okuthile okuboniswa ngokusebenzisa intetho ethile; igama elisetyenziswa kwizifundo zefilosofi yeelwimi ngokuthe nakwizifundo ngeentsingiselo malunga nokuthile (into, imeko yombandela othile, njalo njalo) kwihlabathi elingaphandle apho loo ntetho ngokwezifundo ngeelwimi ibhekiselele khona (Crystal, 2008: 408)",igama elithi: 'umntwana' kumzekelo ongasentla lalatha ekubhekiselelwa kuko,,,,,"i rito, ntlawa wa marito kumbe xivulwana lexi hlamuselaka xanchumu eka ndhawu ya xiviri","1 xikongomi xi tirha ku kongomisa eka munhu kumbe xanchumu 2 Magezi i xikongomi eka xivulwa xa ""Magezi wa ndzi ba"" 3 ""Misaveni"" na ""ximanga"" haswimbirhi i swikongomi eka xivulwa xa ""Misaveni u ba ximanga"""
unisa_multilingual_linguistic_terminology_275,reflected meaning,moelelo o bonahaditsweng,tlhalošokgopolwa,Inshokutsi lesobala,Lifurase tsumbedzwa,ligama elinehlathululo emsulwa,intetho ebhekiselela kokuthile,igama elinencazelo emsulwa evama ukusetshenziswa mayelana negama elingenayo incazelo emsulwa,bokao bo bo supilweng,nhlamuseloxiwelo,"when a speaker uses a word innocently to convey a particular meaning (Louwrens, 1994:166)",,ha sebui se sebedisa lentswe hantle ho fetisa molaetsa o itseng,ntate o tlohile ka lepotlapotla a sa dumedisa (lepotlapotla le bontsha moelelo wa ho potlaka),kgopolo ye e šomišwago ka thutotlhalošo go laetša ge motheeletši a ekwa lentšu gomme monagano wa gagwe o tshelela go le lengwe la go swana le lona ka kwagatšo eupša le na le tlhalošo ya go se kgahliše,"Ge e ka re mmoledi a bolela ka 'go ja' (ya tlhalošotheo) gomme motheeleti a sega ka ge a gopola thobalano, kamantšho yeo ya tlhalošo e bitšwa tlhalošokgopolwa",Kulapho sikhulumi siveta inshokutsi yemagama lesiwakhulumako.,Inkhulumo yamake inenshokutsi lesobala ayidzingi kuhunyushwa.,Musi muambi a tshi shumisa ipfi nga u sa li dzhiela ntha a tshi toda u pfukisa munwe muhumbulo.,,ligama elinehlathululo emsulwa evame ukusetjenziswa mayelana negama elinganayo ihlathululo emsulwa,"Igama elithi iphasela litjho into ephathwa ngokufihlekileko, ligama elivame ukusetjenziselwa imali lokha nawuhloniphako.","naliphi igama, iqela lamagama okanye ibinzana lamagama elibonisa okuthile kwihlabathi lenene (Louwrens, 1994:166)",intetho ebandakanya igama elithi: 'wayefunqule' kumzekelo ongasentla yintetho ebhekiselela kokuthile,inkulumo emsulwa uma isetshenziswa  ukubhekisa kulokho okungemsulwa,igama elithi ikhekhe elisho umbhako othakwe ngofulawa noshukela nezinye izithako livama ukusetshenziswa ngendlela engemsulwa ukubhekisa esithweni sangasese sabesifazane,fa mmui a dirisa lefoko a sa nagane kwa pele mme le kaya bokao jo bo rileng,Fa re re rre o ijetse re a bo re dirisa bokao jo bo supilweng,hiloko xivulavuri xi tirhisa rito hi ku pfumala nandzu ku rhumela marungula ya nhlamuselo yo karhi,endzhaku ka ku nwa byalwa u ta vona nhlamuseloxiwelo
unisa_multilingual_linguistic_terminology_276,reflexive,boiketsi,leitiri,Kwenta,Lidiiti,isakhi sokuzenza,intsingiselo enxulunyaniswayo,isakhi sokuzenza,leitiri,xitlhelelo,a morpheme which expresses the idea that the subject of the verb is in fact directly affected by the action or process,,mofimi o bonahatsang mohopolo wa hore moetsi wa leetsi o amehile ka nnete ka kotloloho ke ketso kapa tshebetso,"mme o itlhabile ka thipa letsohong (mofimi i, ho leetsi itlhabile, o bontsha boiketsi, e leng seo mme a se entseng ho yena)",taetšo ya gore tiro e dirwa go modiri wa yona,Leitiri re le tseba ka hlogo ya i-,Sakhi lesiletsa umcondvo wekutsi inhloko yesento itsintseka ngco ngesenteko.,Uyatibona ngemphela  akangabati ngesimo sakhe.,Mofimi une wa sumbedza muhumbulo wa uri dzina li bveledzaho nyito lo kwamea nga nyito kana bveledziso.,,Isakhi sepambosi yokuzenza siza ngaphambi kwesiqu sesenzo esinepambosi yokwenzela yesakhi u-el- ukuletha umqondo wokobana lokho okweziwa sisenzo ihloko isuke izenzela yona ngokwayo. Ipambosi le ibonakala ngesakhi sokuzenza u-zi-,Isibonelo. UThemba uyazilalela nakadiniweko. Kilomutjho igama uyazilalela linesakhi u-zi- esitjengisa bonyana uThemba njengehloko yomutjho uyazenza ngokwakhe.,"xa isithethi sisebenzisa igama msulwa ukuqhubela phambili intsingiselo ethile (Louwrens, 1994:166)",kumzekelo wesivakalisi esingasentla igama elithi: 'wayefunqule' sisenzi esinentsingiselo enxulunyaniswa nomntwana kunye nomama,isakhi esiveza ukuthi isenzeko senziwa nguye umenzi noma inhloko yomusho kuye,mina ngithanda ukusebenzisa isakhi sokuzenza uma ngifuna ukusho ukuthi ngiyazisebenzela,popi e e tlhagisang kakanyo ya gore sediri sa lediri ka nnete se amiwa ka tlhamalalo ke tiragalo e e diragalang,"polelo e e reng, 'malome o ipoma moriri', e dirisitse leitiri, 'ipoma', go bontsha ke ene a iting tiro ya go poma",i xiaki lexi hlamuselaka vonelo leri nhlokomhaka ya riendli kahlekahle ri khumbekaka hi ku kongomisa hi swendlo kumbe maendlelo,rhavi ra xitlhelelo ri komba mhaka yi tlhelela eka muendli wa yona
unisa_multilingual_linguistic_terminology_277,relative,leamanyi,,Sibaluli,Litaluli,,,,,engetelo,a term which refers to a word which qualifies a noun or pronoun,,lereo le lebisitseng ho lentswe le lokelang ho ba lebitso kapa leemedi,monna ya soto o bolaile ntja ya nkgono ka sehloho (soto ke leamanyi la motheo/mantlha),,,Ligama lelichaza kabanti ngasobito.,Tonkhe tibaluli tinato tivumelwano.,Themo I sumbedzaho ipfi li talulaho dzina kana lisala.,,,,,,,,,,i theme leri kongomisaka eka rito leri ringanelaka riviti kumbe rivitavito,ndzi twile leswaku ku ta va ni engetelo wa vatirhi nan'waka
unisa_multilingual_linguistic_terminology_278,relative concord,lehokaamanyi,lekgoka-amanyi,Sivumelwano sesibaluli,Lipfanisi la litaluli la vhushaka,isivumelwano sesibaluli,,isivumelwano sesibaluli,thuanyi-amanyi,xitwananisi xa engetelo,a morpheme which brings agreement between the antecedent noun and the relative,,mofimi o tlisang tumellano dipakeng tsa lebitso le antisidente le leamanyi,mosadi ya bohale o shapa bana (ya polelong eo ke yona e kopanyang moetsi le leamanyi),lekgokedi le le hlolago tswalanao gare ga sediri le leamanyi,Mo sekafokong se: 'Monna yo a jago' lekgoka-amanyi ke yo a-,Sakhi lesiletsa kuvumelana kulibito kanye ne sibaluli emshweni,Lesi sivumelwano sesibaluli kulomusho lobutiwe.,Mofimi I fhaho nyandano vhukati ha dzina na vhushaka,a shumaho,Sisakhi esakha ubudlelwana phakathi kukasobizo nesibaluli emutjhweni.,"Isibonelo: Umsana obhema inyawupe uba sithingithingi.  Egameni elithi obhema, ukamisa u-o usivumelwano sesibaluli uveza ubudlelwana phakathi kwebizo eliyihloko nesibaluli esisuselwe esenzweni.",,,isakhi esiletha ubudlelwano phakathi kwebizo nesibaluli emshweni,isivumelwano sesiphawulo siletha ubudlelwano phakathi kukaSobizo nesibaluli emshweni,popi e e tlisang tumelano magareng ga leina le leamanyi,"mo polelong e, 'mosimane yo o utswang o tshwerwe',  'yo o', ke thuanyi-amanyi",i xiaki lexi tisaka ntwanano exikarhi ka xirhangamahlweni xa riviti na xiengetelo,ku ni milawu leyi lawulaka ku tirhisiwa ka xitwananisi xa engetelo
unisa_multilingual_linguistic_terminology_279,relative mood,sekaokamano,modirišokamanyi,Indlela lesibaluli,Limudi la liitilitaluli,,,,modiriso-kamanyi,riengetelo,"the mood of the verb in verbal relative constructions (Louwrens, 1994: 166)",,sekao sa leetsi ho dikaho tse amanang le seo ho buuwang ka sona,mme o rata hore bana ba hae ba hlomphane (polelo ena e bontsha sekaokamano hobane seo mme a se ratang ke kamano ya lerato baneng ba hae),modirišo wa lediri  sebopegong sa leamanyidiri,Mo sekafokong se: 'motho yo a lwalago' - le leamanyi 'yo a lwalago' le bopilwe ka lediri le le lego ka modirišokamanyi,Indlela sento lesikuyo ekwakhiweni kwetento tesibaluli.,Indlela lesibaluli itasichazela kabanti ngalokwentiwa nguPheki  kulomusho.,Limudi la liiti kha u vhumba liitilitaluli.,ane a shuma,,,,,,,modiriso wa lediri o o leng mo popegong ya puo,"fa polelo e re mosimane yo o gorogileng maabane o robetse, 'yo o gorogileng maabane o robetse' ke modiriso-kamanyi",i angulo wa riviti eka ku vumbiwa ka maendli yo engetela,1 riengetelo ri hi byela swin'wana hi riviti 2 riengetelo ri tsariwa ri helela kumbe ri komisiwa
unisa_multilingual_linguistic_terminology_280,relative suffix,sehlongwanthao sa leamanyi,moselana wa leamanyidiri,Sijobelelo sesibaluli,Mutshila wa liitilitaluli,isilungelelo sesibaluli,isibaluli,isijobelelo sesibaluli,setlhongwa sa leamanyi,xilandzi xa riengetelo,"the suffix which occurs with relative verbs (Louwrens, 1994: 168)",,sehlongwanthao se etsahalang le maetsi a amanyang,"bana ba ithutang ba ratwa ke matitjhere a bona (ho lentswe ithutang, sehlongwanthao se tlisang kamano ke ng)",moselana -go o hlomelwago kutudiring ge go bopša leamanyidiri,Mo go 'yo a sepelago' moselana wa leamanyidiri ke -go,Sijobelelo lesifakwa nakwakhiwa sibaluli.,Sitawfaka tivumelwano tesibaluli kulamagama kute ivakale.,Mutshila une wa vha hone kha liitilitaluli.,Nwana a shumaho oswika.,Isilungelelo esisetjenziswa nesenzo ukwakha isibaluli.,Ngifike lokha nabaphumako emhlanganweni. Kilomutjho igama elithi nabaphumako sibaluli esisebenzissa isilungelelo sesibaluli u-ko.,igama elibhekiselela kwigama elichaza isibizo okanye kwisimelabizo,"isibaluli ligama elichaza isibizo okanye isimelabizo njengokuthi: 'Uthethe inyaniso emsulwa', u-'emsulwa' sisibaluli esichaza u-'inyaniso' osisibizo",isakhi esisetshenziselwa ukhwakha isibaluli ngesenzo,egameni elithi abasebenzayo u-yo emshweni othi abantu abasebenzayo bavuka ngovivi uma beya emsebenzini uyisijobelelo sesibaluli esakhiwe ngesenzo,setlhongwa se se tlhagelelang le madiri a maamanyi,"mo go 'ngwana yoo lelang, ke wa me', 'ng' mo go 'lelang', ke setlhongwa sa leamanyi",i xilandzi lexi humelelaka na maendli yo engetela,"1 ""leti"" i xitwananisi xa riengetelo 2 riengetelo ri vumbiwa hi xitwananisi xa riengetelo ni nsinya"
