id,eng,nso,afr,eng_pos_or_descriptor,eng_pos_or_descriptor_info,nso_pos_or_descriptor,nso_pos_or_descriptor_info,afr_pos_or_descriptor,afr_pos_or_descriptor_info
up_glossary_prizes_and_awards_103,Schering Prize,Sefoka sa Schering,Schering-prys,Health Sciences,Radiography,,,Gesondheidswetenskappe,Radiografie
up_glossary_prizes_and_awards_104,Phillips Prize,Sefoka sa Phillips,Phillips-prys,Health Sciences,Radiography,,,Gesondheidswetenskappe,Radiografie
up_glossary_prizes_and_awards_105,Processor Services Prize,Sefoka sa Processor Services,Processor Services-prys,Health Sciences,Radiography,,,Gesondheidswetenskappe,Radiografie
up_glossary_prizes_and_awards_106,GE Medical Prize,Sefoka sa GE Medical,GE Medical-prys,Health Sciences,Radiography,,,Gesondheidswetenskappe,Radiografie
up_glossary_prizes_and_awards_107,ELEKTA Prize,Sefoka sa ELEKTA,ELEKTA-prys,Health Sciences,Radiography,,,Gesondheidswetenskappe,Radiografie
up_glossary_prizes_and_awards_108,Department of Radiography Prize,Sefoka sa Kgoro ya Radiokrafi,Prys van die Departement Radiografie,Health Sciences,Radiography,,,Gesondheidswetenskappe,Radiografie
up_glossary_prizes_and_awards_109,Vona du Toit Trophy,Sebjana sa Vona du Toit,Vona du Toit-trofee,Health Sciences,Occupational Therapy,,,Gesondheidswetenskappe,Arbeidsterapie
up_glossary_prizes_and_awards_110,Northern Gauteng Branch of Occupational Therapists Trophy,Sebjana sa Lekala la Leboa la Gauteng la Diterapi tša Mošomong,Trofee van die Noord-Gautengtak van Arbeidsterapeute,Health Sciences,Occupational Therapy,,,Gesondheidswetenskappe,Arbeidsterapie
up_glossary_prizes_and_awards_111,Clinical Emergencies Trophy,Sebjana sa Clinical Emergencies,Clinical Emergencies-trofee,Health Sciences,Occupational Therapy,,,Gesondheidswetenskappe,Arbeidsterapie
up_glossary_prizes_and_awards_112,Prof W Bodemer Trophy,Sebjana sa Prof W Bodemer,Prof W Bodemer-trofee,Health Sciences,Occupational Therapy,,,Gesondheidswetenskappe,Arbeidsterapie
up_glossary_prizes_and_awards_113,Occupational Therapy for Psychiatry Interest Group Trophy,Sebjana sa Sehlopha sa Terapi ya Mošomong ya,Trofee van die Arbeidsterapie vir Psigiatriebelangstellingsgroep,Health Sciences,Occupational Therapy,,,Gesondheidswetenskappe,Arbeidsterapie
up_glossary_prizes_and_awards_114,,Dikgahlego tša Bolwetši bja Monagano,,Health Sciences,Occupational Therapy,,,Gesondheidswetenskappe,Arbeidsterapie
up_glossary_prizes_and_awards_115,Smith & Nephew Award,Sefoka sa Smith & Nephew,Smith & Nephew-toekenning,Health Sciences,Occupational Therapy,,,Gesondheidswetenskappe,Arbeidsterapie
up_glossary_prizes_and_awards_116,OTASA/UP Staff Award,Sefoka sa OTASA/UP,OTASA/UP-personeel-toekenning,Health Sciences,Occupational Therapy,,,Gesondheidswetenskappe,Arbeidsterapie
up_glossary_prizes_and_awards_117,Hennie Geyer Prize,Sefoka sa Hennie Geyer,Hennie Geyer-prys,Health Sciences,Occupational Therapy,,,Gesondheidswetenskappe,Arbeidsterapie
up_glossary_prizes_and_awards_118,Medop Prize,Sefoka sa Medop,Medop-prys,Health Sciences,Occupational Therapy,,,Gesondheidswetenskappe,Arbeidsterapie
up_glossary_prizes_and_awards_119,Protea Bookstore prize,Sefoka sa Lebenkele la Dipuku la Protea,Protea Boekwinkel-prys,Health Sciences,Occupational Therapy,,,Gesondheidswetenskappe,Arbeidsterapie
up_glossary_prizes_and_awards_120,Van Schaik Publishers Prize,Sefoka sa Baphatlalatši ba Van Schaik,Van Schaik Uitgewers-prys,Health Sciences,Occupational Therapy,,,Gesondheidswetenskappe,Arbeidsterapie
up_glossary_prizes_and_awards_121,S Moagi Award,Sefoka sa S Moagi,S Moagi-toekenning,Health Sciences,Occupational Therapy,,,Gesondheidswetenskappe,Arbeidsterapie
up_glossary_prizes_and_awards_122,E Ramano Award,Sefoka sa E Ramano,E Ramano-toekenning,Health Sciences,Occupational Therapy,,,Gesondheidswetenskappe,Arbeidsterapie
up_glossary_prizes_and_awards_123,D Castelijn Prize,Sefoka sa D Castelijn,D Castelijn-prys,Health Sciences,Occupational Therapy,,,Gesondheidswetenskappe,Arbeidsterapie
up_glossary_prizes_and_awards_124,SAETRA Prize,Sefoka sa SAETRA,SAETRA-prys,Health Sciences,Occupational Therapy,,,Gesondheidswetenskappe,Arbeidsterapie
up_glossary_prizes_and_awards_125,M Bekker Prize,Sefoka sa M Bekker,M Bekker-prys,Health Sciences,Occupational Therapy,,,Gesondheidswetenskappe,Arbeidsterapie
up_glossary_prizes_and_awards_126,Friends of Weskoppies Prize,Sefoka sa Bagwera ba Weskoppies,Vriende van Weskoppies-prys,Health Sciences,Occupational Therapy,,,Gesondheidswetenskappe,Arbeidsterapie
up_glossary_prizes_and_awards_127,Protea Bookstore Prize,Sefoka sa Lebenkele la Dipuku la Protea,Protea Boekwinkel-prys,Health Sciences,Dietetics,,,Gesondheidswetenskappe,Dieetkunde
up_glossary_prizes_and_awards_128,NNIA Award,Sefoka sa NNIA,NNIA - toekenning,Nestlé / Health Sciences,Dietetics,Nestlé,,Nestlé / Gesondheidswetenskappe,Dieetkunde
up_glossary_prizes_and_awards_129,Nestlé Award,Sefoka sa Nestlé,Nestlé-toekenning,Health Sciences,Dietetics,,,Gesondheidswetenskappe,Dieetkunde
up_glossary_prizes_and_awards_130,Fresenius Kabi Award,Sefoka sa Fresenius Kabi,Fresenius Kabi-toekenning,Health Sciences,Dietetics,,,Gesondheidswetenskappe,Dieetkunde
up_glossary_prizes_and_awards_131,Novo Nordisk Award,Sefoka sa Novo Nordisk,Novo Nordisk-toekenning,Health Sciences,Dietetics,,,Gesondheidswetenskappe,Dieetkunde
up_glossary_prizes_and_awards_132,Roche Novo Nordisk Award,Sefoka sa Roche Novo Nordisk,Roche Novo Nordisk-toekenning,Health Sciences,Dietetics,,,Gesondheidswetenskappe,Dieetkunde
up_glossary_prizes_and_awards_133,Abbott Special Award,Sefoka sa Go ikgetha sa Abbott,Abbott- Spesiale Toekenning,Abbott / Health Sciences,Dietetics,Abbott,,Abbott / Gesondheidswetenskappe,Dieetkunde
up_glossary_prizes_and_awards_134,Abbott Special Award,Sefoka sa Go ikgetha sa Abbott,Abbott- Spesiale Toekenning,B Braun / Health Sciences,Dietetics,B Braun,,B Braun / Gesondheidswetenskappe,Dieetkunde
up_glossary_prizes_and_awards_135,ADSA and NSSA Special Award,Sefoka sa Go ikgetha sa ADSA le NSSA,ADSA- en NSSA- Spesiale Toekenning,Health Sciences,Dietetics,,,Gesondheidswetenskappe,Dieetkunde
up_glossary_prizes_and_awards_136,Hilda Lategan Book Prize,Sefoka sa Dipuku sa Hilda Lategan,Hilda Lategan-boekprys,Health Sciences,Dietetics,,,Gesondheidswetenskappe,Dieetkunde
up_glossary_prizes_and_awards_137,Adcock Ingram Award,Sefoka sa Adcock Ingram,Adcock Ingram-toekenning,Health Sciences,Dietetics,,,Gesondheidswetenskappe,Dieetkunde
up_glossary_prizes_and_awards_138,Maretha Vermaak Award,Sefoka sa Maretha Vermaak,Maretha Vermaak-toekenning,Health Sciences,Dietetics,,,Gesondheidswetenskappe,Dieetkunde
up_glossary_prizes_and_awards_139,Department of Human Nutrition,Kgoro ya Phepo ya Batho,Toekenning van die Departement Mensvoeding,Health Sciences,Dietetics,,,Gesondheidswetenskappe,Dieetkunde
up_glossary_prizes_and_awards_140,B Braun Medical Award,Sefoka sa B Braun Medical,B Braun Medical-toekenning,Health Sciences,Dietetics,,,Gesondheidswetenskappe,Dieetkunde
up_glossary_prizes_and_awards_141,Kellogg's Award,Sefoka sa Kellogg's,Kellogg's-toekenning,Health Sciences,Dietetics,,,Gesondheidswetenskappe,Dieetkunde
up_glossary_prizes_and_awards_142,Paediatric Nutrition Work Group Prize,Sehlopha sa Mošomo wa Phepo ya Bana,Prys van die Werkgroep vir Kindervoeding,Health Sciences,Dietetics,,,Gesondheidswetenskappe,Dieetkunde
up_glossary_prizes_and_awards_143,Unilever Award,Sehlopha sa Unilever,Unilever-toekenning,Health Sciences,Dietetics,,,Gesondheidswetenskappe,Dieetkunde
up_glossary_prizes_and_awards_144,,,,Health Sciences,Dentistry,,,Gesondheidswetenskappe,Tandheelkunde
up_glossary_prizes_and_awards_145,Department of Health Certificate,Setifikeiti sa Kgoro ya Maphelo,Sertifikaat van die Departement van Gesondheid,Health Sciences,Dentistry,,,Gesondheidswetenskappe,Tandheelkunde
up_glossary_prizes_and_awards_146,Endodontic Society Prize,Sefoka sa Lekgotla la Endodontiki,Prys van die Endodonsievereniging,Health Sciences,Dentistry,,,Gesondheidswetenskappe,Tandheelkunde
up_glossary_prizes_and_awards_147,GV Black Prize,Sefoka sa GV Black,GV Black-prys,Health Sciences,Dentistry,,,Gesondheidswetenskappe,Tandheelkunde
up_glossary_prizes_and_awards_148,Swann-Morton Maxillo-Facial and Oral Surgery Prize,Sefoka sa Bobui bja Sefahlego le Molomo sa Swann-Morton Maxillo,"Swann-Morton-prys vir Kaak-, Gesig- en Mondchirurgie",Health Sciences,Dentistry,,,Gesondheidswetenskappe,Tandheelkunde
up_glossary_prizes_and_awards_149,Harry Goldin Prize,Sefoka sa Harry Goldin,Harry Goldin-prys,Health Sciences,Dentistry,,,Gesondheidswetenskappe,Tandheelkunde
up_glossary_prizes_and_awards_150,Jan Duvenhage Award,Sefoka sa Jan Duvenhage,Jan Duvenhage-toekenning,Health Sciences,Dentistry,,,Gesondheidswetenskappe,Tandheelkunde
up_glossary_prizes_and_awards_151,Wright-Millners Prize,Sefoka sa Wright-Millners,Wright-Millners-prys,Health Sciences,Dentistry,,,Gesondheidswetenskappe,Tandheelkunde
up_glossary_prizes_and_awards_152,Periodontics Sensodyne Prize,Sefoka sa Periodontics Sensodyne,Sensodyne-prys vir Periodonsie,Health Sciences,Dentistry,,,Gesondheidswetenskappe,Tandheelkunde
up_glossary_prizes_and_awards_153,South African Society for Periodontology Prize,Sefoka sa Lekgotla la Afrika Borwa la Periontolotši,Prys van die Suid-Afrikaanse Vereniging vir Periodontologie,Health Sciences,Dentistry,,,Gesondheidswetenskappe,Tandheelkunde
up_glossary_prizes_and_awards_154,Dentsply Prize,Sefoka sa Dentsply,Dentsply-prys,Health Sciences,Dentistry,,,Gesondheidswetenskappe,Tandheelkunde
up_glossary_prizes_and_awards_155,Brooklyn Surgical Centre Floating Trophy,Sebjana sa go Theta sa Senthara ya Bobui ya Brooklyn,Wisseltrofee van die Brooklyn Chirurgiese Sentrum,Health Sciences,Dentistry,,,Gesondheidswetenskappe,Tandheelkunde
up_glossary_prizes_and_awards_156,Ross Barrowman Prize,Sefoka sa Ross Barrowman,Ross Barrowman-prys,Health Sciences,Dentistry,,,Gesondheidswetenskappe,Tandheelkunde
up_glossary_prizes_and_awards_157,Prossa Prizes,Difoka tša Prossa,Prossa-pryse,Health Sciences,Dentistry,,,Gesondheidswetenskappe,Tandheelkunde
up_glossary_prizes_and_awards_158,WA Wiltshire Prize,Sefoka sa WA Wiltshire,WA Wiltshire-prys,Health Sciences,Dentistry,,,Gesondheidswetenskappe,Tandheelkunde
up_glossary_prizes_and_awards_159,Gold Medal of the South African Dental Association,Metale wa Gauta wa Mokgatlo wa Meno wa Afrika Borwa,Goue Medalje van die Suid-Afrikaanse Tandheelkundige Vereniging,Health Sciences,Dentistry,,,Gesondheidswetenskappe,Tandheelkunde
up_glossary_prizes_and_awards_160,Bronze Medals of the South African Dental Association,Metale wa Pronse wa Lekgotla/Mokgatlo la/wa Meno wa Afrika Borwa,Bronsmedaljes van die Suid-Afrikaanse Tandheelkundige Vereniging,Health Sciences,Dentistry,,,Gesondheidswetenskappe,Tandheelkunde
up_glossary_prizes_and_awards_161,The South African Dental Association Leadership Award,Sefoka sa Boetapele bja Lekgotla/Mokgatlo la/wa Meno wa Afrika Borwa,Die Suid-Afrikaanse Tandheelkundige Leierskapstoekenning,Health Sciences,Dentistry,,,Gesondheidswetenskappe,Tandheelkunde
up_glossary_prizes_and_awards_162,Chris Snijman Prize,Sefoka sa Chris Snijman,Chris Snijman-prys,Health Sciences,Dentistry,,,Gesondheidswetenskappe,Tandheelkunde
up_glossary_prizes_and_awards_163,Department of Health Merit Certificate,Setifikeiti sa Bokgoni sa Kgoro ya Maphelo,Departement van Gesondheid se Sertifikaat vir Verdienstelikheid,Health Sciences,Dentistry,,,Gesondheidswetenskappe,Tandheelkunde
up_glossary_prizes_and_awards_164,Eugénie Brewis Prize,Sefoka sa Eugénie Brewis,Eugénie Brewis-prys,Health Sciences,Dentistry,,,Gesondheidswetenskappe,Tandheelkunde
up_glossary_prizes_and_awards_165,Sensodyne Prize,Sefoka sa Sensodyne,Sensodyne-prys,Health Sciences,Dentistry,,,Gesondheidswetenskappe,Tandheelkunde
up_glossary_prizes_and_awards_166,Wright-Millners Prize,Sefoka sa Wright-Millners,Wright-Millners-prys,Health Sciences,Dentistry,,,Gesondheidswetenskappe,Tandheelkunde
up_glossary_prizes_and_awards_167,Reinor Prize,Sefoka sa Reinor,Reinor-prys,Health Sciences,Dentistry,,,Gesondheidswetenskappe,Tandheelkunde
up_glossary_prizes_and_awards_168,Oral Hygienists' Association of South Africa Merit Certificate,Setifikeiti sa Phalano sa Lekgotla/Mokgatlo la/wa Maphelo a Molomo la/wa Afrika Borwa,Sertifikaat vir Verdienstelikheid van die Suid-Afrikaanse Vereniging van Mondhigiëniste,Health Sciences,Dentistry,,,Gesondheidswetenskappe,Tandheelkunde
up_glossary_prizes_and_awards_169,WC Röntgen Prize,Sefoka sa WC Röntgen,WC Röntgen-prys,Health Sciences,Dentistry,,,Gesondheidswetenskappe,Tandheelkunde
up_glossary_prizes_and_awards_170,William Updegrave Prize,Sefoka sa William Updegrave,William Updegrave-prys,Health Sciences,Dentistry,,,Gesondheidswetenskappe,Tandheelkunde
up_glossary_prizes_and_awards_171,Dental Warehouse Prize,Sefoka sa Dental Warehouse,Dental Warehouse-prys,Health Sciences,Dentistry,,,Gesondheidswetenskappe,Tandheelkunde
up_glossary_prizes_and_awards_172,John van der Sandt de Villiers Medal and Floating Trophy,Sebjana sa go Theta le Metale wa John van der Sandt de Villiers,John van der Sandt de Villiers-medalje en -wisseltrofee,Health Sciences,Dentistry,,,Gesondheidswetenskappe,Tandheelkunde
up_glossary_prizes_and_awards_173,Best First Year Student HMS - academic,Moithuti yo Mokaone wa Ngwaga wa Mathomo wa HMS - thuto,Beste Eerstejaarstudent MBK - akademies,Humanities,Sports Science,,,Geesteswetenskappe,Sportwetenskap
up_glossary_prizes_and_awards_174,Best Second Year Student HMS - academic,Moithuti yo Mokaone wa Ngwaga wa Bobedi wa HMS - thuto,Beste Tweedejaarstudent MBK - akademies,Humanities,Sports Science,,,Geesteswetenskappe,Sportwetenskap
up_glossary_prizes_and_awards_175,Best Third Year Student HMS - academic,Moithuti yo Mokaone wa Ngwaga wa Boraro wa HMS - thuto,Beste Derdejaarstudent MBK - akademies,Humanities,Sports Science,,,Geesteswetenskappe,Sportwetenskap
up_glossary_prizes_and_awards_176,Best Third Year HMS Option Sports Psychology - academic,Moithuti yo Mokaone wa Ngwaga wa Boraro wa HMS wa Saekholotši ya Dipapadi tša Kgetho- thuto,Beste Derdejaarstudent MBK Opsie Sportsielkunde - akademies,Humanities,Sports Science,,,Geesteswetenskappe,Sportwetenskap
up_glossary_prizes_and_awards_177,Best First Year Student in Sports Science - academic,Moithuti yo Mokaone wa Ngwaga wa Mathomo ka Saense ya Dipapadi - thuto,Beste Eerstejaarstudent in Sportwetenskap - akademies,Humanities,Sports Science,,,Geesteswetenskappe,Sportwetenskap
up_glossary_prizes_and_awards_178,Best Second Year Student in Sports Science - academic,Moithuti yo Mokaone wa Ngwaga wa Bobedi ka Saense ya Dipapadi - thuto,Beste Tweedejaarstudent in Sportwetenskap - akademies,Humanities,Sports Science,,,Geesteswetenskappe,Sportwetenskap
up_glossary_prizes_and_awards_179,Best Third Year Student in Sports Science - academic,Moithuti yo Mokaone wa Ngwaga wa Boraro ka Saense ya Dipapadi - thuto,Beste Derdejaarstudent in Sportwetenskap - akademies,Humanities,Sports Science,,,Geesteswetenskappe,Sportwetenskap
up_glossary_prizes_and_awards_180,Leadership,Boetapele,Leierskap,Humanities,Sports Science,,,Geesteswetenskappe,Sportwetenskap
up_glossary_prizes_and_awards_181,Best Sport Performance in Sports Science,Papalo ya Dipapadi ye Kaone ka Disaense tša Dipapadi,Beste Sportprestasie in Sportwetenskap,Humanities,Sports Science,,,Geesteswetenskappe,Sportwetenskap
up_glossary_prizes_and_awards_182,Best Biokinetics Student - academic,Moithuti yo Mokaone wa Payokaenethiki - thuto,Beste Biokinetikastudent - akademies,Humanities,Sports Science,,,Geesteswetenskappe,Sportwetenskap
up_glossary_prizes_and_awards_183,Best Biokinetics Student - practical,Moithuti yo Mokaone wa Payokaenethiki - tirišo,Beste Biokinetika student - prakties,Humanities,Sports Science,,,Geesteswetenskappe,Sportwetenskap
up_glossary_prizes_and_awards_184,Best Sports Science Student - theory,Moithuti yo Mokaone wa Saense ya Dipapadi - teori,Beste Sportwetenskapstudent - teorie,Humanities,Sports Science,,,Geesteswetenskappe,Sportwetenskap
up_glossary_prizes_and_awards_185,Best Sports Science Student - practical,Moithuti yo Mokaone wa Saense ya Dipapadi - tirišo,Beste Sportwetenskapstudent - prakties,Humanities,Sports Science,,,Geesteswetenskappe,Sportwetenskap
up_glossary_prizes_and_awards_186,Best Biokinetics Student - academic: Certificate and medal of Biokinetics Association of South Africa,Moithuti yo Mokaone wa Payokaenethiki - thuto: Setifikeiti le metale wa Payokaenethiki wa Afrika Borwa,Beste Biokinetikastudent - akademies: Sertifikaat en Medalje van Biokinetika-vereniging van Suid-Afrika,BASA / Humanities,Sports Science,BASA,,BASA / Geesteswetenskappe,Sportwetenskap
up_glossary_prizes_and_awards_187,Attorneys Fidelity Fund Bursaries,Sekhwama sa Dipasari sa Potego ya Boramolao,Getrouheidsfonds vir Prokureurs-beurse,Law,,,,Regsgeleerdheid,
up_glossary_prizes_and_awards_188,Norton Rose Scholarship,Thekgo ya Ditšhelete tša Thuto ya Norton Rose,Norton Rose-beurs,Law,,,,Regsgeleerdheid,
up_glossary_prizes_and_awards_189,Weavind & Weavind Bursary,Pasari ya Weavind & Weavind,Weavind & Weavind-beurs,Law,,,,Regsgeleerdheid,
up_glossary_prizes_and_awards_190,Werksmans Bursary,Pasari ya Werksmans Werksmans-beurs,,Law,,,,Regsgeleerdheid,
up_glossary_prizes_and_awards_191,South African Institute for Intellectual Property Law Bursary,Institute ya Afrika Borwa ya Pasari ya Molao wa Thoto ya Monagano,Suid-Afrikaanse Instituut vir Intellektuele Goederereg-beurs,Law,,,,Regsgeleerdheid,
up_glossary_prizes_and_awards_192,Street Law 410 Certificate of Merit,Setifikeiti sa Bokgoni sa Molao wa Mokgotheng wa 410,Straatreg 410-merietesertifikaat,Law,,,,Regsgeleerdheid,
up_glossary_prizes_and_awards_193,Law of Securities 410 Certificate of Merit,Setifikeiti sa Bokgoni sa Molao wa Tšhireletšo wa 410,Effektereg 410-merietesertifikaat,Law,,,,Regsgeleerdheid,
up_glossary_prizes_and_awards_194,Private Law 410 Certificate of Merit,Setifikeiti sa Bokgoni sa Molao wa Praebete wa 410,Privaatreg 410-merietesertifikaat,Law,Dean's Merit List Certificates,,,Regsgeleerdheid,
up_glossary_prizes_and_awards_195,Private International Law 410 Certificate of Merit,Setifikeiti sa Bokgoni sa Molao wa Praebete wa Ditšhabatšhaba wa 410,Internasionale Privaatreg 410-merietesertifikaat,Law,Dean's Merit List Certificates,,,Regsgeleerdheid,
up_glossary_prizes_and_awards_196,Deeds and Notarial Practice 410 Certificate of Merit,Setifikeiti sa Bokgoni sa Mangwalo le Tirišo ya Senothori a 410,Aktes- en Notariële Praktyk 410-merietesertifikaat,Law,Dean's Merit List Certificates,,,Regsgeleerdheid,
up_glossary_prizes_and_awards_197,Historical Foundations of SA Private Law 110 Certificate of Merit,Setifikeiti sa Bokgoni sa Metheo ya Histori ya Molao wa Praebete wa 110,Historiese Grondslae van die SA Privaatreg 110-merietesertifikaat,Law,Dean's Merit List Certificates,,,Regsgeleerdheid,
up_glossary_prizes_and_awards_198,Law of Contract 220 Certificate of Merit,Setifikeiti sa Bokgoni sa Molao wa Kontraka wa 220,Kontraktereg 220-merietesertifikaat,Law,Dean's Merit List Certificates,,,Regsgeleerdheid,
up_glossary_prizes_and_awards_199,Comparative Law 410 Certificate of Merit,Setifikeiti sa Bokgoni sa Molao wa Papetšo wa 410,Regsvergelyking 410-merietesertifikaat,Law,Dean's Merit List Certificates,,,Regsgeleerdheid,
up_glossary_prizes_and_awards_200,Juta Law Prize,Sefoka sa Molao wa Juta,Juta Regte-prys,Law,Dean's Merit List Certificates,,,Regsgeleerdheid,
up_glossary_prizes_and_awards_201,Dean's Merit List,Lenaneo la Bokgoni la Hlogo ya Lefapha,Dekaan se Merietelys,Law,Dean's Merit List Certificates,,,Regsgeleerdheid,
up_glossary_prizes_and_awards_202,Land and Land Reform 420 Certifificate of Merit,Setifikeiti sa Bokgoni sa Naga le Mpshafatšo/Tlhabollo ya Naga ya 420,Grond- en Grondhervormingsreg 420-merietesertifikaat,Law,Dean's Merit List Certificates,,,Regsgeleerdheid,
up_glossary_prizes_and_awards_203,Law of Securities 410 Certificate of Merit,Setifikeiti sa Bokgoni sa Molao wa Ditšhireletšo wa 410,Effektereg 410-merietesertifikaat,Law,Dean's Merit List Certificates,,,Regsgeleerdheid,
up_glossary_prizes_and_awards_204,Constitutional Law 210 Certificate of Merit,Setifikeiti sa Bokgoni sa Molaotheo wa Mmušo wa 210,Staatsreg 210-merietesertifikaat,Law,Dean's Merit List Certificates,,,Regsgeleerdheid,
up_glossary_prizes_and_awards_205,Education Law 420 Certificate of Merit,Setifikeiti sa Bokgoni sa Molao wa Thuto wa 420,Onderwysreg 420-merietesertifikaat,Law,Dean's Merit List Certificates,,,Regsgeleerdheid,
up_glossary_prizes_and_awards_206,Criminal Law 410 Certificate of Merit,Setifikeiti sa Bokgoni sa Molao wa Bosenyi wa 410,Strafreg 410-merietesertifikaat,Law,Dean's Merit List Certificates,,,Regsgeleerdheid,
up_glossary_prizes_and_awards_207,Sports Law 420 Certificate of Merit,Setifikeiti sa Bokgoni sa Molao wa Dipapadi wa 420,Sportreg 420-merietesertifikaat,Law,Dean's Merit List Certificates,,,Regsgeleerdheid,
up_glossary_prizes_and_awards_208,Law of Securities 410 Certificate of Merit,Setifikeiti sa Bokgoni sa Molao wa Ditšhireletšo,Effektereg 410-merietesertifikaat,Law,Dean's Merit List Certificates,,,Regsgeleerdheid,
up_glossary_prizes_and_awards_209,Third Party Compensation Law 420 Certificate of Merit,Setifikeiti sa Bokgoni sa Molao wa Tefo ya Setho sa Boraro wa 420,Derdepartyvergoedingsreg 420-merietesertifikaat,Law,Dean's Merit List Certificates,,,Regsgeleerdheid,
up_glossary_prizes_and_awards_210,Civil Procedure 420 Certificate of Merit,Setifikeiti sa Bokgoni sa Tshepedišo ya Segae ya 420,Siviele Prosesreg 420-merietesertifikaat,Law,Dean's Merit List Certificates,,,Regsgeleerdheid,
up_glossary_prizes_and_awards_211,Law of Persons 110 Certificate of Merit,Setifikeiti sa Bokgoni sa Molao wa Batho wa 110,Personereg 110-merietesertifikaat,Law,Dean's Merit List Certificates,,,Regsgeleerdheid,
up_glossary_prizes_and_awards_212,Trusts and Estates 410 Certificate of Merit,Setifikeiti sa Bokgoni sa Ditrasete le Mafa tša 410,Trusts en Boedels 410-merietesertifikaat,Law,Dean's Merit List Certificates,,,Regsgeleerdheid,
up_glossary_prizes_and_awards_213,Philosophical Perspectives on Legal Problems 410 Certificate of Merit,Setifikeiti sa Bokgoni sa Ponego ya Filosofi ka Mathata a Molao wa 410,Filosfiese Perspektiewe op Regsprobleme 410-merietesertifikaat,Law,Dean's Merit List Certificates,,,Regsgeleerdheid,
up_glossary_prizes_and_awards_214,International Law 420 Certificate of Merit,Setifikeiti sa Bokgoni sa Molao wa Ditšhabatšhaba wa 420,Internasionale Reg 420-merietesertifikaat,Law,Dean's Merit List Certificates,,,Regsgeleerdheid,
up_glossary_prizes_and_awards_215,Moot Court 420 Certificate of Merit,Setifikeiti sa Bokgoni sa Kgoro ya Dikakanyo ya 420,Skynhof 420-merietesertifikaat,Law,Dean's Merit List Certificates,,,Regsgeleerdheid,
up_glossary_prizes_and_awards_216,Legal Practice 310 Certificate of Merit,Setifikeiti sa Bokgoni sa Tirišo ya Molao wa 310,Regspraktyk 310-merietesertifikaat,Law,Dean's Merit List Certificates,,,Regsgeleerdheid,
up_glossary_prizes_and_awards_217,Supervised Internship 420 Certificate of Merit,Setifikeiti sa Bokgoni sa Thutišo ya mošomo yeo e Hlapeditšwego ya 420,Internskap onder Toesig 420-merietesertifikaat,Law,Dean's Merit List Certificates,,,Regsgeleerdheid,
up_glossary_prizes_and_awards_218,Alternative Dispute Resolution 420 Certificate of Merit,Setifikeiti sa Bokgoni sa 420 sa Tharollo ya Ngangišano ya Tlhatlolano/Tšhielano,Alternatiewe Geskilbeslegting 420-merietesertifikaat,Law,Dean's Merit List Certificates,,,Regsgeleerdheid,
up_glossary_prizes_and_awards_219,Media Law 420 Certificate of Merit,Setifikeiti sa Bokgoni sa Molao wa tša Bobegaditaba wa 420,Mediareg 420-merietesertifikaat,Law,Dean's Merit List Certificates,,,Regsgeleerdheid,
up_glossary_prizes_and_awards_220,Social Security Law 420 Certificate of Merit,Setifikeiti sa Bokgoni sa Molao wa Tšhireletšo ya Leago wa 420,Sosiale Sekerheidsreg 420-merietesertifikaat,Law,Dean's Merit List Certificates,,,Regsgeleerdheid,
up_glossary_prizes_and_awards_221,Legal Skills 120 Certifificate,Setifikeiti sa Mabokgoni a Molao a 120,Regsvaardighede 120-sertifikaat,Law,Dean's Merit List Certificates,,,Regsgeleerdheid,
up_glossary_prizes_and_awards_222,Practical Law 420,Molao wa Tirišo wa 420,Praktiese Regskunde 420-sertifikaat,Law,Dean's Merit List Certificates,,,Regsgeleerdheid,
up_glossary_prizes_and_awards_223,Introduction to Law 110 Certificate,Setifikeiti sa Tsebišo ya Molao wa 110,Inleiding tot die Reg 110-sertifikaat,Law,Dean's Merit List Certificates,,,Regsgeleerdheid,
up_glossary_prizes_and_awards_224,African Human Rights 410 Certificate,Setifikeiti sa Ditokelo tša Batho ba Afrika tša 410,Afrika-menseregte 410-sertifikaat,Law,Dean's Merit List Certificates,,,Regsgeleerdheid,
up_glossary_prizes_and_awards_225,Shadrack Mbonani Memorial Prize,Sefoka sa Segopotšo sa Shadrack Mbonani,Shadrack Mbonani-gedenkprys,Law,Dean's Merit List Certificates,,,Regsgeleerdheid,
up_glossary_prizes_and_awards_226,Dean's Merit List Prize,Sefoka sa Lenaneo la Bokgoni sa Hlogo ya Lefapha,Dekaan se Merietelys-prys,Law,Dean's Merit List Certificates,,,Regsgeleerdheid,
up_glossary_prizes_and_awards_227,D&T Trust Prize,Sefoka sa Trasete ya D&T,D&T Trust-prys,Law,Dean's Merit List Certificates,,,Regsgeleerdheid,
up_glossary_prizes_and_awards_228,Certificate of Merit,Setifikeiti sa Bokgoni,Merietesertifikaat,Law,Dean's Merit List Certificates,,,Regsgeleerdheid,
up_glossary_prizes_and_awards_229,Cliffe Dekker Hofmeyr Inc Prize,Sefoka sa Kopanyo sa Cliffe Dekker Hofmey,Cliffe Dekker Hofmeyr Ing-prys,Law,Dean's Merit List Certificates,,,Regsgeleerdheid,
up_glossary_prizes_and_awards_230,Consumer Protection 220 Certificate of Merit,Setifikeiti sa Bokgoni sa Tšhireletšo ya Bareki ya 220,Verbruikerbeskerming 220-merietesertifikaat,Law,Dean's Merit List Certificates,,,Regsgeleerdheid,
