id,eng,nso,afr,eng_pos_or_descriptor,eng_pos_or_descriptor_info,nso_pos_or_descriptor,nso_pos_or_descriptor_info,afr_pos_or_descriptor,afr_pos_or_descriptor_info
up_glossary_prizes_and_awards_0,UP Vice-Chancellor's Book Awards,Difoka tša Dipuku tša Motlatšamokhanseliri wa UP,UP Visekanseliersboektoekennings,Vice-Chancellor and Principal,,,,Visekanselier en Rektor,
up_glossary_prizes_and_awards_1,Dean's List Awards,Lenaneo la Difoka la Hlogo ya Lefapha,Dekaanslys-toekennings,Economic and Management Science,Dean's Office/Dekaanskantoor,,,Ekonomiese en Bestuurswetenskappe,Dekaanskantoor
up_glossary_prizes_and_awards_2,Investec Prize,Sefoka sa Investec,Investec-prys,Economic and Management Science,Department of Financial Management,,,Ekonomiese en Bestuurswetenskappe,Departement Finansiele Bestuur
up_glossary_prizes_and_awards_3,KPMG Prize,Sefoka sa KPMG,KPMG-prys,Economic and Management Science,Department of Financial Management,,,Ekonomiese en Bestuurswetenskappe,Departement Finansiele Bestuur
up_glossary_prizes_and_awards_4,LexisNexis Book Prize,Sefoka sa Dipuku tša LexisNexis,LexisNexis-boekprys,Economic and Management Science,Department of Financial Management,,,Ekonomiese en Bestuurswetenskappe,Departement Finansiele Bestuur
up_glossary_prizes_and_awards_5,Standard Bank Prize,Sefoka sa Standard Bank,Standard Bank-prys,Economic and Management Science,Department of Financial Management,,,Ekonomiese en Bestuurswetenskappe,Departement Finansiele Bestuur
up_glossary_prizes_and_awards_6,Mc Gregor BFA Prize,Sefoka sa Mc Gregor BFA,Mc Gregor BFA-prys,Economic and Management Science,Department of Financial Management,,,Ekonomiese en Bestuurswetenskappe,Departement Finansiele Bestuur
up_glossary_prizes_and_awards_7,PricewaterhouseCoopers Prize,Sefoka sa PriceWaterhouse Coopers,PricewaterhouseCoopers-prys,Economic and Management Science,Department of Financial Management,,,Ekonomiese en Bestuurswetenskappe,Departement Finansiele Bestuur
up_glossary_prizes_and_awards_8,Momentum Prize,Sefoka sa Momentum Momentum-prys,,Economic and Management Science,Department of Financial Management,,,Ekonomiese en Bestuurswetenskappe,Departement Finansiele Bestuur
up_glossary_prizes_and_awards_9,CIMA Prize,Sefoka sa CIMA,CIMA-prys,Economic and Management Science,Department of Financial Management,,,Ekonomiese en Bestuurswetenskappe,Departement Finansiele Bestuur
up_glossary_prizes_and_awards_10,Nedbank Prize,Sefoka sa Nedbank,Nedbank-prys,Economic and Management Science,Department of Financial Management,,,Ekonomiese en Bestuurswetenskappe,Departement Finansiele Bestuur
up_glossary_prizes_and_awards_11,Russell Loubser JSE Merit Prize,Sefoka sa Bokgoni sa Russell Loubser JSE,Russell Loubser JAM-merieteprys,Economic and Management Science,Department of Financial Management,,,Ekonomiese en Bestuurswetenskappe,Departement Finansiele Bestuur
up_glossary_prizes_and_awards_12,Credit Guarantee Bursary,Pasari ya Credit Guarantee,Credit Guarantee-beurs,Economic and Management Science,Department of Financial Management,,,Ekonomiese en Bestuurswetenskappe,Departement Finansiele Bestuur
up_glossary_prizes_and_awards_13,ACCA Prize,Sefoka sa ACCA,ACCA-prys,Association of Chartered Certified Accountants / Economic and Management Science,Department of Accounting,Lekgotla/Mokgatlo la/wa Dibalamatlotlo tšeo di Hlatsetšwego,,Vereniging van Gesertifiseerde Geoktrooieerde Rekenmeesters / Ekonomiese en Bestuurswetenskappe,Departement Rekeningkunde
up_glossary_prizes_and_awards_14,Nedbank Prize,Sefoka sa Nedbank,Nedbank-prys,Economic and Management Science,Department of Accounting,,,Ekonomiese en Bestuurswetenskappe,Departement Rekeningkunde
up_glossary_prizes_and_awards_15,Standard Bank Prize,Sefoka sa Standard Bank,Standard Bank-prys,Economic and Management Science,Department of Accounting,,,Ekonomiese en Bestuurswetenskappe,Departement Rekeningkunde
up_glossary_prizes_and_awards_16,BDO Prize - overall performance in CTA,Sefoka sa BDO - Tiragatšo/Phethagatšo ka kakaretšo kaCTA,BDO-prys - algehele prestasie in CTA,Certificate in Theory of Accounting / Economic and Management Science,Department of Accounting,Setifikeite saTeori ya Sešupatlotlo,,Sertifikaat in Rekeningkundige Teorie / Ekonomiese en Bestuurswetenskappe,Departement Rekeningkunde
up_glossary_prizes_and_awards_17,Deloitte Merit Prize,Sefoka sa Bokgoni sa Deloitte,Deloitte-merieteprys,Economic and Management Science,Department of Accounting,,,Ekonomiese en Bestuurswetenskappe,Departement Rekeningkunde
up_glossary_prizes_and_awards_18,Deloitte Prize,Sefoka sa Deloitte,Deloitte-prys,Economic and Management Science,Department of Accounting,,,Ekonomiese en Bestuurswetenskappe,Departement Rekeningkunde
up_glossary_prizes_and_awards_19,PricewaterhouseCoopers Merit Prize - ACC 100,Sefoka sa Bokgoni sa PriceWaterhouse- Coopers - ACC 100,PricewaterhouseCoopers-merieteprys - ACC 100,Economic and Management Science,Department of Accounting,,,Ekonomiese en Bestuurswetenskappe,Departement Rekeningkunde
up_glossary_prizes_and_awards_20,PricewaterhouseCoopers Merit Prize - ACC 101,Sefoka sa Bokgoni sa PriceWaterhouse- Coopers - ACC 101,PricewaterhouseCoopers-merieteprys - ACC 101,Economic and Management Science,Department of Accounting,,,Ekonomiese en Bestuurswetenskappe,Departement Rekeningkunde
up_glossary_prizes_and_awards_21,Momentum Prize - ACC 100,Sefoka sa Momentum - ACC 100,Momentum-prys - ACC 100,Economic and Management Science,Department of Accounting,,,Ekonomiese en Bestuurswetenskappe,Departement Rekeningkunde
up_glossary_prizes_and_awards_22,Momentum Prize - ACC 101,Sefoka sa Momentum - ACC 101,Momentum-prys - ACC101,Economic and Management Science,Department of Accounting,,,Ekonomiese en Bestuurswetenskappe,Departement Rekeningkunde
up_glossary_prizes_and_awards_23,LexisNexis Prize - ACC 311 and 321,Sefoka sa LexisNexis - ACC 311 le 321,LexisNexis-prys - ACC 311 en 321,Economic and Management Science,Department of Accounting,,,Ekonomiese en Bestuurswetenskappe,Departement Rekeningkunde
up_glossary_prizes_and_awards_24,LexisNexis Prize - ACC300,Sefoka sa LexisNexis - ACC300,LexixNexis-prys - Acc 300,Economic and Management Science,Department of Accounting,,,Ekonomiese en Bestuurswetenskappe,Departement Rekeningkunde
up_glossary_prizes_and_awards_25,Auditor-General Prize,Sefoka sa Mohlakišipharephare,Prys van die Ouditeur-Generaal,Economic and Management Science,Department of Accounting,,,Ekonomiese en Bestuurswetenskappe,Departement Rekeningkunde
up_glossary_prizes_and_awards_26,KPMG Prize - ACC 311 and 321,Sefoka sa KPMG - ACC 311 le 321,KPMG-prys - ACC 311 en 321,Economic and Management Science,Department of Accounting,,,Ekonomiese en Bestuurswetenskappe,Departement Rekeningkunde
up_glossary_prizes_and_awards_27,Leask Prize,Sefoka sa Leask,Leask-prys,Economic and Management Science,Department of Accounting,,,Ekonomiese en Bestuurswetenskappe,Departement Rekeningkunde
up_glossary_prizes_and_awards_28,Mervitz & Malan Prize,Sefoka sa Mervitz & Malan,Mervitz & Malan-prys,Economic and Management Science,Department of Accounting,,,Ekonomiese en Bestuurswetenskappe,Departement Rekeningkunde
up_glossary_prizes_and_awards_29,Ernst & Young Prize,Sefoka sa Ernst & Young,Ernst & Young-prys,Economic and Management Science,Department of Accounting,,,Ekonomiese en Bestuurswetenskappe,Departement Rekeningkunde
up_glossary_prizes_and_awards_30,Grant Thornton Prize,Sefoka sa Grant Thornton,Grant Thornton-prys,Economic and Management Science,Department of Accounting,,,Ekonomiese en Bestuurswetenskappe,Departement Rekeningkunde
up_glossary_prizes_and_awards_31,ABSA Prize,Sefoka sa ABSA,ABSA-prys,Economic and Management Science,Department of Accounting,,,Ekonomiese en Bestuurswetenskappe,Departement Rekeningkunde
up_glossary_prizes_and_awards_32,Best First Year Practical Project Award - ATKV Prize,Sefoka sa Protšeke ya Tirišo ye Kaone ya Ngwaga wa Mathomo - Sefoka sa ATKV,Toekenning vir die Beste Praktiese Projek in die Eerste Jaar - ATKV-prys,Economic and Management Science,Department Tourism Management,,,Ekonomiese en Bestuurswetenskappe,Departement Toerismebestuur
up_glossary_prizes_and_awards_33,Top Frist Year Student Award - Court Classique Suite Hotel Prize,Sefoka sa Moithuti yo Mokaone wa Ngwaga wa Mathomo - Sefoka sa Court Classique Suite Hotel,Toekenning vir die Beste Eerstejaarstudent - Court Classique Suite Hotel-prys,Economic and Management Science,Department Tourism Management,,,Ekonomiese en Bestuurswetenskappe,Departement Toerismebestuur
up_glossary_prizes_and_awards_34,Top Third Year Student Award - Court Classique Suite Hotel Prize,Sefoka sa Moithuti yo Mokaone wa Ngwaga wa Boraro - Sefoka sa Court Classique Suite Hotel,Toekenning vir die Beste Derdejaarstudent - Court Classique Suite Hotel-prys,Economic and Management Science,Department Tourism Management,,,Ekonomiese en Bestuurswetenskappe,Departement Toerismebestuur
up_glossary_prizes_and_awards_35,Best Second Year Practical Project Award - Sanparks Prize,Sefoka sa Protšeke ya Tirišo ye Kaone ya Ngwaga wa Bobedi - Sefoka sa Sanparks,Toekenning vir die Beste Praktiese Projek in die Tweede Jaar - Sanparks-prys,Economic and Management Science,Department Tourism Management,,,Ekonomiese en Bestuurswetenskappe,Departement Toerismebestuur
up_glossary_prizes_and_awards_36,Top Second Year Student Award - Town Lodge Menlo Park Prize,Sefoka sa Moithuti yo Mokaone wa Ngwaga wa Bobedi - Sefoka sa Town Lodge Menlo Park,Toekenning vir die Beste Tweedejaarstudent - Town Lodge Menlopark-prys,Economic and Management Science,Department Tourism Management,,,Ekonomiese en Bestuurswetenskappe,Departement Toerismebestuur
up_glossary_prizes_and_awards_37,Best Third Year Practical Project Award - Grant Thornton Prize,Sefoka sa Protšeke ya Tirišo ye Kaone ya Ngwaga wa Boraro - Sefoka sa Grant Thorton,Toekenning vir die Beste Praktiese Projek in die Derde Jaar - Grant Thornton-prys,Economic and Management Science,Department Tourism Management,,,Ekonomiese en Bestuurswetenskappe,Departement Toerismebestuur
up_glossary_prizes_and_awards_38,Top Third Year Student Award - Reservation House Prize,Sefoka sa Moithuti yo Mokaone wa Ngwaga wa Boraro - Sefoka sa Reservation House,Toekenning vir die Beste Derdejaarstudent - Reservation House-prys,Economic and Management Science,Department Tourism Management,,,Ekonomiese en Bestuurswetenskappe,Departement Toerismebestuur
up_glossary_prizes_and_awards_39,Honours Students Awards - Travel with Flair Prize,Difoka tša Baithuti ba Onase - Sefoka sa Travel with Flair,Honneursstudente-toekennings - Travel with Flair-prys,Economic and Management Science,Department Tourism Management,,,Ekonomiese en Bestuurswetenskappe,Departement Toerismebestuur
up_glossary_prizes_and_awards_40,Top Honours Student Award - Travel with Flair Prize,Sefoka sa Moithuti yo Mokaone wa Onase - Travel with Flair Prize,Toekenning vir die Beste Honneursstudent - Travel with Flair-prys,Economic and Management Science,Department Tourism Management,,,Ekonomiese en Bestuurswetenskappe,Departement Toerismebestuur
up_glossary_prizes_and_awards_41,Reservation House Award,Sefoka sa Reservation House,Reservation House-toekenning,Economic and Management Science,Department Tourism Management,,,Ekonomiese en Bestuurswetenskappe,Departement Toerismebestuur
up_glossary_prizes_and_awards_42,PPP Student Award,Sefoka sa Moithuti wa PPP,PPP-studentetoekenning,Economic and Management Science,Department Tourism Management,,,Ekonomiese en Bestuurswetenskappe,Departement Toerismebestuur
up_glossary_prizes_and_awards_43,Van Schaik Achievement Prize,Sefoka sa Bokgoni sa Van Schaik,Van Schaik-prestasieprys,Economic and Management Science,Department of Business Management,,,Ekonomiese en Bestuurswetenskappe,Departement Ondernemings-bestuur
up_glossary_prizes_and_awards_44,Chair in Logistics Prize - OS 210,Sefoka sa Setulo ka Logistiki - OS 210,Leerstoel in Logistiek-prys - OS 210,Economic and Management Science,Department of Business Management,,,Ekonomiese en Bestuurswetenskappe,Departement Ondernemings-bestuur
up_glossary_prizes_and_awards_45,JA Stegman Prize,Sefoka sa JA Stegman,JA Stegman-prys,Economic and Management Science,Department of Business Management,,,Ekonomiese en Bestuurswetenskappe,Departement Ondernemings-bestuur
up_glossary_prizes_and_awards_46,Durlinger Consultancy Prize - OBS 216,Sefoka sa Durlinger Consultancy - OBS 216,Durlinger Consultancy-prys - OBS 216,BCom SCM / Economic and Management Science,Department of Business Management,BCom SCM,,BCom SCM / Ekonomiese en Bestuurswetenskappe,Departement Ondernemings-bestuur
up_glossary_prizes_and_awards_47,Durlinger Consultancy Prize - OBS 226,Sefoka sa Durlinger Consultancy - OBS 226,Durlinger Consultancy-prys - OBS 226,BCom SCM / Economic and Management Science,Department of Business Management,BCom SCM,,BCom SCM / Ekonomiese en Bestuurswetenskappe,Departement Ondernemings-bestuur
up_glossary_prizes_and_awards_48,Dr Alex Antonites Creativity Prize - OBS 213,Sefoka sa Boithomelo sa Dr Alex Antonites - OBS 213,Dr Alex Antonites-kreatiwiteitsprys - OBS 213,Economic and Management Science,Department of Business Management,,,Ekonomiese en Bestuurswetenskappe,Departement Ondernemings-bestuur
up_glossary_prizes_and_awards_49,Chair in Entrepreneurship - OBS 223,Setulo ka Botsebakgwebo - OBS 223,Leerstoel in Entrepreneurskap - OBS 223,Economic and Management Science,Department of Business Management,,,Ekonomiese en Bestuurswetenskappe,Departement Ondernemings-bestuur
up_glossary_prizes_and_awards_50,Department of Business Management Prize - OBS 320,Sefoka sa Kgoro ya Taolo ya Kgwebo - OBS 320,Prys van die Departement Ondernemingsbestuur - OBS 320,Economic and Management Science,Department of Business Management,,,Ekonomiese en Bestuurswetenskappe,Departement Ondernemings-bestuur
up_glossary_prizes_and_awards_51,Chair in Logistics - OBS 316,Setulo ka Logistiki - OBS 316,Leerstoel in Logistiek - OBS 316,Economic and Management Science,Department of Business Management,,,Ekonomiese en Bestuurswetenskappe,Departement Ondernemings-bestuur
up_glossary_prizes_and_awards_52,Chair in Logistics - OBS 326,Setulo ka Logistiki - OBS 326,Leerstoel in Logistiek - OBS 326,Economic and Management Science,Department of Business Management,,,Ekonomiese en Bestuurswetenskappe,Departement Ondernemings-bestuur
up_glossary_prizes_and_awards_53,Chair in Entrepreneurship - OBS 313,Setulo ka Botsebakgwebo - OBS 313,Leerstoel in Entrepreneurskap - OBS 313,Economic and Management Science,Department of Business Management,,,Ekonomiese en Bestuurswetenskappe,Departement Ondernemings-bestuur
up_glossary_prizes_and_awards_54,Chair in Entrepreneurship - OBS 323,Setulo ka Botsebakgwebo -OBS 323,Leerstoel in Entrepreneurskap - OBS 323,Economic and Management Science,Department of Business Management,,,Ekonomiese en Bestuurswetenskappe,Departement Ondernemings-bestuur
up_glossary_prizes_and_awards_55,G4S Africa Prize,Sefoka sa Afrika sa G4S,G4S Afrika-prys,Economic and Management Science,Department of Business Management,,,Ekonomiese en Bestuurswetenskappe,Departement Ondernemings-bestuur
up_glossary_prizes_and_awards_56,Chair in Entrepreneurship - OBS 311 and 321,Setulo ka Botsebakgwebo -OBS 311 le 321,Leerstoel in Entrepreneurskap - OBS 311 en 321,Economic and Management Science,Department of Business Management,,,Ekonomiese en Bestuurswetenskappe,Departement Ondernemings-bestuur
up_glossary_prizes_and_awards_57,Dr Ralph Pallium Prize,Sefoka sa Ngaka/Dr Ralph Pallium,Dr Ralph Pallium-prys,Economic and Management Science,Department of Business Management,,,Ekonomiese en Bestuurswetenskappe,Departement Ondernemings-bestuur
up_glossary_prizes_and_awards_58,Dr WA de Villiers Prize,Sefoka sa Ngaka/Dr de Villiers,Dr WA de Villiers-prys,Economic and Management Science,Department of Business Management,,,Ekonomiese en Bestuurswetenskappe,Departement Ondernemings-bestuur
up_glossary_prizes_and_awards_59,Department of Business Management Prize - OBS 790,Sefoka sa Kgoro ya Taolo ya Kgwebo - OBS 790,Prys van die Departement Ondernemingsbestuur - OBS 790,Economic and Management Science,Department of Business Management,,,Ekonomiese en Bestuurswetenskappe,Departement Ondernemings-bestuur
up_glossary_prizes_and_awards_60,Rupert Education Foundation Prize,Sefoka sa Motheo wa Thuto wa Rupert,Rupert-Onderwysstigting-prys,Economic and Management Science,Department of Business Management,,,Ekonomiese en Bestuurswetenskappe,Departement Ondernemings-bestuur
up_glossary_prizes_and_awards_61,Prof GH Nieman Prize - BCom Ent,Sefoka sa Prof GH Nieman - Bcom Ent,Prof GH Nieman-prys - Bcom Ent,Economic and Management Science,Department of Business Management,,,Ekonomiese en Bestuurswetenskappe,Departement Ondernemings-bestuur
up_glossary_prizes_and_awards_62,Mamelodi Business Clinic Prize,Sefoka sa Kliniki ya Kgwebo ya Mamelodi,Mamelodi-sakekliniekprys,Economic and Management Science,Department of Business Management,,,Ekonomiese en Bestuurswetenskappe,Departement Ondernemings-bestuur
up_glossary_prizes_and_awards_63,Chair in Logistics - GLB 780,Setulo ka Logistiki - OBS 780,Leerstoel in Logistiek - GLB 780,Economic and Management Science,Department of Business Management,,,Ekonomiese en Bestuurswetenskappe,Departement Ondernemings-bestuur
up_glossary_prizes_and_awards_64,Cengage Prize,Sefoka sa Cengage,Cengage-prys,Economic and Management Science,Department of Business Management,,,Ekonomiese en Bestuurswetenskappe,Departement Ondernemings-bestuur
up_glossary_prizes_and_awards_65,CIPS Southern Africa Prize (Chartered Institute of,Sefoka sa CIPSA Southern Africa (Chartered Institute of,CIPS Southern Africa-prys (Chartered Institute of,Economic and Management Science,Department of Business Management,,,Ekonomiese en Bestuurswetenskappe,Departement Ondernemings-bestuur
up_glossary_prizes_and_awards_66,Purchasing and Supply Southern Africa),Purchasing and Supply Southern Africa),Purchasing and Supply Southern Africa),Economic and Management Science,Department of Business Management,,,Ekonomiese en Bestuurswetenskappe,Departement Ondernemings-bestuur
up_glossary_prizes_and_awards_67,Oxford University Press Prize,Sefoka sa Oxford University Press,Oxford University Press-prys,Economic and Management Science,Department of Business Management,,,Ekonomiese en Bestuurswetenskappe,Departement Ondernemings-bestuur
up_glossary_prizes_and_awards_68,Juta Achievement Prize,Sefoka sa Bokgoni sa Juta,Juta-prestasieprys,Economic and Management Science,Department of Business Management,,,Ekonomiese en Bestuurswetenskappe,Departement Ondernemings-bestuur
up_glossary_prizes_and_awards_69,Van Schaik Publishers Ltd Prize,Sefoka sa Baphatlalatši ba Van Schaik,Van Schaik Uitgewers Bpk-prys,Pty / Economic and Management Science,Department of Business Management,,,Edms / Ekonomiese en Bestuurswetenskappe,Departement Ondernemings-bestuur
up_glossary_prizes_and_awards_70,Sasol Ltd Prize,Sefoka sa Sasol Ltd,Sasol Bpk-prys,Economic and Management Science,Department of Business Management,,,Ekonomiese en Bestuurswetenskappe,Departement Ondernemings-bestuur
up_glossary_prizes_and_awards_71,Juta Legal and Academic Publishers Prize,Sefoka sa Baphatlalatši ba Molao le Thuto ba Juta,Juta Regs- en Akademiese Uitgewers-prys,Economic and Management Science,Department of Business Management,,,Ekonomiese en Bestuurswetenskappe,Departement Ondernemings-bestuur
up_glossary_prizes_and_awards_72,G4S Secure Solution Ltd Prize,Sefoka sa G4S Secure Solution Ltd,G4S Secure Solution Bpk-prys,SA / Pty / Economic and Management Science,Department of Business Management,SA / Pty,,SA / Edms / Ekonomiese en Bestuurswetenskappe,Departement Ondernemings-bestuur
up_glossary_prizes_and_awards_73,Nedbank Ltd Prize,Sefoka sa Nedbank Ltd,Nedbank Bpk-prys,Economic and Management Science,Department of Business Management,,,Ekonomiese en Bestuurswetenskappe,Departement Ondernemings-bestuur
up_glossary_prizes_and_awards_74,Heinemann Publishers SA Ltd Prize,Baphatlalatši ba Heinemann SA Ltd,Heinemann Uitgewers SA Bpk-prys,Pty / Economic and Management Science,Department of Business Management,Pty,,Edms / Ekonomiese en Bestuurswetenskappe,Departement Ondernemings-bestuur
up_glossary_prizes_and_awards_75,Pearson SA Prize,Sefoka sa Pearson SA,Pearson SA -prys,Ltd / Economic and Management Science,Department of Business Management,Ltd,,Bpk / Ekonomiese en Bestuurswetenskappe,Departement Ondernemings-bestuur
up_glossary_prizes_and_awards_76,Durlinger Consultancy Prize,Sefoka sa Durlinger Consultancy,Durlinger Consultancy-prys,Economic and Management Science,Department of Business Management,,,Ekonomiese en Bestuurswetenskappe,Departement Ondernemings-bestuur
up_glossary_prizes_and_awards_77,Departmental Achievement Award,Sefoka sa Bokgoni sa Kgoro,Departementele Prestasietoekenning,Economic and Management Science,Department of Marketing Management,,,Ekonomiese en Bestuurswetenskappe,Departement Bemarkingsbestuur
up_glossary_prizes_and_awards_78,Consulta Research Award,Sefoka sa Dinyakišišo/Diphatišišo tša Consulta,Consulta-navorsingstoekenning,Economic and Management Science,Department of Marketing Management,,,Ekonomiese en Bestuurswetenskappe,Departement Bemarkingsbestuur
up_glossary_prizes_and_awards_79,Stephan & Pierre Viljoen Stipend/Bursary/Scholarship,Moputso/Pasari/Thekgo ya Ditšhelete tša Thuto ya Stephan & Pierre Viljoen,Stephan & Pierre Viljoen-stipendium/beurs/studiebeurs,Economic and Management Science,Department of Marketing Management,,,Ekonomiese en Bestuurswetenskappe,Departement Bemarkingsbestuur
up_glossary_prizes_and_awards_80,Dean's Award,Sefoka sa Hlogo ya Lefapha,Dekaanstoekenning,Education,Dean,,,Opvoedkunde,Dekaan
up_glossary_prizes_and_awards_81,Annual Top Achiever Award,Sefoka sa Mokgoni yo Mokaone wa Ngwaga,Jaarlikse Beste Presteerder-toekenning,,,,,,
up_glossary_prizes_and_awards_82,Charlotte Searle Floating Trophy,Sebjana sa go Theta sa Charlotte Searle,Carlotte Searle-wisseltrofee,Health Sciences,Nursing Sciences,,,Gesondheidswetenskappe,Verpleegkunde
up_glossary_prizes_and_awards_83,Protea Bookstore prize,Sefoka sa Lebenkele la Dipuku la Protea,Protea Boekhuisprys,Health Sciences,Nursing Sciences,,,Gesondheidswetenskappe,Verpleegkunde
up_glossary_prizes_and_awards_84,Henriëtta Stockdale Floating Trophy,Sebjana sa go Theta sa Henriëtta Stockdale,Henriëtta Stockdale-wisseltrofee,Health Sciences,Nursing Sciences,,,Gesondheidswetenskappe,Verpleegkunde
up_glossary_prizes_and_awards_85,JD Ackerman Prize,Sefoka sa JD Ackerman,JD Ackerman-prys,Health Sciences,Nursing Sciences,,,Gesondheidswetenskappe,Verpleegkunde
up_glossary_prizes_and_awards_86,Department of Nursing Prize,Sefoka sa Kgoro ya Booki,Prys van die Departement Verpleegkunde,Health Sciences,Nursing Sciences,,,Gesondheidswetenskappe,Verpleegkunde
up_glossary_prizes_and_awards_87,Denmar Specialist Psychiatric Hospital Prize,Sefoka sa Bookelo bja Setsebi sa Malwetši a Monagano sa Denmar,Prys van die Denmar Spesialis-Psigiatriese Hospitaal,Health Sciences,Nursing Sciences,,,Gesondheidswetenskappe,Verpleegkunde
up_glossary_prizes_and_awards_88,Protea Bookstore prize,Sefoka sa Lebenkele la Dipuku la Protea,Protea-boekwinkelprys,Health Sciences,Physiotherapy,,,Gesondheidswetenskappe,Fisioterapie
up_glossary_prizes_and_awards_89,SA Physiotherapy Society Prize,Lekgotla la Fisioterapi la Afrika Borwa,Prys van die SA Fisioterapievereniging,Northern Gauteng / Health Sciences,Physiotherapy,Leboa la Gauteng,,Noord-Gauteng / Gesondheidswetenskappe,Fisioterapie
up_glossary_prizes_and_awards_90,HiTech Therapy Prize,Sefoka sa HiTech Therapy,HiTech Therapy-prys,Health Sciences,Physiotherapy,,,Gesondheidswetenskappe,Fisioterapie
up_glossary_prizes_and_awards_91,Mediotronics Prize,Sefoka sa Mediotronics,Mediotronics-prys,Health Sciences,Physiotherapy,,,Gesondheidswetenskappe,Fisioterapie
up_glossary_prizes_and_awards_92,Marius van Onselen Prize,Sefoka sa Marius van Onselen,Marius van Onselen-prys,Health Sciences,Physiotherapy,,,Gesondheidswetenskappe,Fisioterapie
up_glossary_prizes_and_awards_93,Van Schaik Publishers Prize,Sefoka sa Baphatlalatši ba Van Schaik,Van Schaik Uitgewers-prys,Braamfontein branch / Health Sciences,Physiotherapy,Lekala la Braamfontein,,Braamfonteintak / Gesondheidswetenskappe,Fisioterapie
up_glossary_prizes_and_awards_94,Van Schaik Publishers Prize,Sefoka sa Baphatlalatši ba Van Schaik,Van Schaik Uitgewers-prys,Pretoria branch / Health Sciences,Physiotherapy,Lekala la Pretoria,,Pretoria-tak / Gesondheidswetenskappe,Fisioterapie
up_glossary_prizes_and_awards_95,Nicola Buhrs Prize,Sefoka sa Nicola Buhrs,Nicola Buhrs-prys,Health Sciences,Physiotherapy,,,Gesondheidswetenskappe,Fisioterapie
up_glossary_prizes_and_awards_96,Orthopaedic Manipulative Therapy Prize,Sefoka sa Terapi ya Bokgoni ya Othopediki,Ortopediese Manipulasieterapieprys,Health Sciences,Physiotherapy,,,Gesondheidswetenskappe,Fisioterapie
up_glossary_prizes_and_awards_97,Department of Physiotherapy Prize,Sefoka sa Kgoro ya Fisioterapi,Prys van die Departement Fisioterapie,Bafana Sihlali / Health Sciences,Physiotherapy,Bafana Sihlali,,Bafana Sihlali / Gesondheidswetenskappe,Fisioterapie
up_glossary_prizes_and_awards_98,Department of Physiotherapy Prize,Sefoka sa Kgoro ya Fisioterapi,Prys van die Departement Fisioterapie,Health Sciences,Physiotherapy,,,Gesondheidswetenskappe,Fisioterapie
up_glossary_prizes_and_awards_99,Rehabworx Prize,Sefoka sa Rehabworx,Rehabworx-prys,Health Sciences,Physiotherapy,,,Gesondheidswetenskappe,Fisioterapie
up_glossary_prizes_and_awards_100,BSN Medical Prize,Sefoka sa BSN Medical,BSN Medical-prys,Health Sciences,Physiotherapy,,,Gesondheidswetenskappe,Fisioterapie
up_glossary_prizes_and_awards_101,Agfa Prize,Sefoka sa Agfa,Agfa-prys,Health Sciences,Radiography,,,Gesondheidswetenskappe,Radiografie
up_glossary_prizes_and_awards_102,AXIM Prize,Sefoka sa AXIM,AXIM-prys,Health Sciences,Radiography,,,Gesondheidswetenskappe,Radiografie
